Display Racks  Retail Displays  Racks Industrial   Amazoncom www amazon com Retail Display Racks b ie UTF8 node 8615564011 Results 1  16 of 394  Set of 2 Wire Store Fixture Countertop Retail Display Rack 3 Tiers Open  plastic for corrosion resistance and aluminum for a balance of 	1
Cope Cable Tray US www copecabletray com  Cope is the original brand of cable tray In 1948 Thomas Jefferson Cope developed the first modular cable tray system and introduced it to the electrical industry 	2
Metal Supply Aluminum Stainless Steel Magnesium Aerospace  www hadco metal com  Metal supplier and plastic materials distributor including plastics aluminum stainless steel and other metals as well as piping systems welding equipment 	1
Welding Wire Flux and Rods  Lincoln Electric www lincolnelectric com en us consumables Pages consumables aspx No shielding gas required brings the productivity of wire welding to outdoor  Casting its own aluminum rod enables holding extremely tight tolerances in the 	0
Automotive Wire  Cable  General Cable® www generalcable com na us can products solutions specialty automotive products General Cable is the answer for Original Equipment Manufacturers OEMs Tier I and II suppliers Automotive Aftermarket Retailers and OEM distribution 	2
Crawford Electric Supply  Official Website www crawfordelectricsupply com  Crawford is dedicated to doing whatever it takes to serve and satisfy the commercial industrial and residential markets with electrical supplies and experts	2
CrystaLite Inc Skylights Sunrooms  Railing crystaliteinc com   install easily with no electrical wiring or structural changes and blend seamlessly into your roof line  Our primary supplier of aluminum is SAPA Inc based in Portland They receive their raw billet from regional suppliers in Ferndale and The 	1
Friedman Electric  Official Website www friedmanelectric com  For over 80 years Friedman Electric has been providing expert supply and service capabilities For any electrical need our job is to make your job easier	2
Republic Wire Copper Distribution www republicwire com  Aluminum and Copper Wire Manufacturing for electrical wholesale distributor utility distributors RUS investorowned utilities and municipalities	2
Bonding Wires for Semiconductor Technology www heraeus com media media het doc_het products_and_solutions_het_documents bonding_wires_documents Brochure_Bonding_Wire pdf General Bonding Wire Characteristics 9 Gold Bonding Wires 10 Aluminum Bonding Wires 14 Copper Bonding Wires 17 Aluminum Bonding Ribbons 20	0
Locations  Electrical Supply Store  Electrical Retailer  Electrical  www kmelectric com electrical products locations  To find a KM location near you visit the locations page to locate your local electrical supplies store	1
Vertical Balers for cardboard plastic aluminum commercial retail ptrco com vertical_balers_standard_models_ptr   and services vertical Hydraulic balers for commercial industrial and retail use  the baling of cardboard plastic PET bottles aluminum cans and siding  Automatic Ejection System Wire Tie Guides Choice of Colors – See Color Chart	2
China Bonsai Wire Bonsai Wire Manufacturers Suppliers Price  www made in china com products search hot china products Bonsai_Wire html 684 products  Material Aluminum Wire Cross Sectional Shape Round Application Construction Wire Mesh Protecting Mesh Fence Mesh Decorative Mesh 	2
TW Metals Specialty Metals Suppliers  Industrial Metal Distributors www twmetals com  TW Metals specialty metal distributor stocks and processes Tube Pipe Bar Extrusions Sheet and Plate in stainless aluminum nickel titanium and carbon alloy  Tubing Shop Products Pipe Shop Products Bar Rod Wire Shop Products 	1
Artistic Wire www beadalon com prodcat artistic_wire asp Artistic Wire  Braid · Artistic Wire  Hexagonal · Artsy Wire · Artistic Wire  Twisted · Flat Pattern Wire · Flat Artistic Wire · Wire Assortments · Aluminum Craft Wire	1
Aluminum Wires  Aluminium Metalizing Wire Aluminium Wires  dir indiamart com impcat aluminum wires html biz 40 Find here Aluminum Wires Aluminium Metalizing Wire Retailers  Retail Merchants India Get contact details  address of companies retailing manufacturing 	1
Scrapper How to Start a Scrap Metal Collection Business www thebalancesmb com collecting scrap metal for profit 4025697 Nonferrous metals include copper aluminum stainless steel and others  include copper wire and piping brass fixtures aluminum siding and chairs old  and their personnel and understand the pros and cons of various scrap dealers	0
Academy FenceNJ Fence Installation Professionals Repair Vinyl  www academyfence com  Welded Wire Vinyl Coated  Academy Fence Company  Whether it is aluminum vinyl chain link wood or welded wire fencing you can be assured that we offer 	1
Irby Co  Irby Electrical Distributor and Irby Utilities www irby com  Irby is an electrical distributor dedicated to being a highvalue partner providing total electrical solutions Building profitable partnerships since 1926	1
Sheet Metal at Lowescom www lowes com pl Sheet metal Metal rods shapes sheets Hardware 4294684417 Steelworks 24in W x 48in L Bright Aluminum Tread Plate Tread Plate Sheet Metal 14 Write  MD 24in W x 3ft L Aluminum Aluminum Sheet Metal 3 Write 	1
MultiMig 522 www chiefautomotive com welding aluminum welders multimig 522  Welding and brazing of aluminum alloys galvanized sheet metal stainless and  set of synergic programs in memory for brazing welding and aluminum wire	1
Find a Store  Forney Industries www forneyind com support find a store Looking for a Forney distributor near you Use this tool to enter your zip code to see the closest store near you selling Forney products	2
Aluminum Triplex Overhead Conductor www nassaunationalcable com triplex cable wire html Application Aluminum Triplex Overhead cable wire is designed for use to supply power from utility lines to the consumer weather head For service at 600 volts 	1
Chainmail Wire Types  Chainmail 101 How to Make Chainmail chainmail101 com chainmail wire types When making armour with aluminum be sure to use at least 14 gauge wire  You can find large quantities of it on both online retailers and hardware stores	0
Part 14 Regulation of Metal Dealers le utah gov xcode Title76 Chapter6 C76 6 P14_1800010118000101 pdf a a scrap metal processor or secondary metals dealer or recycler but does not include i junk dealers as  B aluminum wire siding downspouts or gutters	0
How To Install Swage Balls Oval Sleeves and Wire Crimps  YouTube www youtube com watch v 2ve1FQ2yYC0 Apr 8 2015  Shop here httpswwwstandoffsystemscomproductswiresystems Gyford Standoff  How To Install Swage Balls Oval Sleeves and Wire Crimps  To find an authorized retailer click here httpswwwstandoffsystemscomretai  IWISS Wire Rope Crimping Tools for Aluminum Sleeves Swaging end 	0
Hardware Cloth  Welded Wire Mesh Mesh Screen  More at Ace  www acehardware com departments hardware window and screen hardware screen cloth 178 items  W x 25 ft L Charcoal Aluminum Insect Screening 2999  Phifer Wire 36 in W x 7 ft L Aluminum Screen Cloth 1299  Compare Phifer Wire 28 in	2
Discount Steel  Alro Steel Metals Outlets www alro com MetalsOutlets  Alro Metals Outlet offers discount metals and plastics in a convenient retail setting for customers looking for fast service Locate your closest location now	1
KeyLink Fencing  Railing  Quality Aluminum Fencing  Railing keylinkonline com  Turn your dream outdoor living space into a reality with the KeyLink Fencing  Railing full line of Aluminum Railing Fencing  and all of our products including our popular vertical and horizontal cable rail infill  LOCATE A DEALER	2
Aluminum Industry Profitability by quarter Gross Operating and Net  csimarket com Industry industry_Profitability_Ratios php ind 104 Aluminum Industry Gross Margin Operating EBITDA Net and Pre Tax Margin high low and average from 2 Q 2019  CSIMarket	0
Coastal Cable Cable Railing  Systems  Kits  Supplies www coastal cable com  Oct 9 2018  At Coastal Cable weve been installing cable railings for many years  on cable supplies is absurdly high so decided to offer cable to the retail 	1
Nova Display Systems Inc  CableRod  Rail Innovative Display  www novadisplay com  Founded in 2000 Nova Display Systems has built a strong reputation for being a supplier of quality visual display solutions and signage Over the years we 	2
Master Halco Home www masterhalco com  Master Halco is the leading wholesale distributor of fencing products across  Lightweight and easy to install Aluminum is an ideal choice for residential fences	1
Speaker Wire www roger russell com wire wire htm To get the same resistance as copper a thicker aluminum wire is needed  speaker ownercustomer to consult with the dealer about what speaker wire to use	0
How to Buy Patio Furniture And Sets We Like for Under 800 for  thewirecutter com reviews best patio furniture  Jun 5 2019  After assembling and using several sets we recommend three made from aluminum wood and steel that we think are a great value and will 	0
Encore Wire Corporation www encorewire com  At Encore Wire we offer onestop sourcing for all your residential commercial and industrial wire needs Backed by a select family of loyal distributors we are 	2
Welding Wire  Walmartcom www walmart com browse industrial scientific welding wire 6197502_7529461_5381350_9927292 Products 1  40 of 664  Shop for Welding Wire in Welding Consumables Buy products such as Forney 42302 035 E71TGS Flux Cored MIG Welding Wire 2 Lb  Best Seller  Product TitleER4043  MIG Aluminum Welding Wire  1 Lb x 0035 	1
Techflexcom  Braided Sleeving Products www techflex com  Techflex engineers  manufactures a wide range of braided sleeving products for wire hose and cable bundling  protection Techflex products are a mainstay 	2
Westbrook Metals Distributor Stainless Steel Aluminum Brass Pipe  www westbrookmetals com  Westbrook Metals in Austin TX  San Antonio Texas is a huge metal distributor specializing in providing our customers with metals in any quantity to fill their 	1
Albright Steel Home albrightsteel com square_tubing_rebar_angle_wire_aluminum  Albright Steel  Wire Browse our Products for Steel  Wire Supplies construction group2 Albright Steel and Wire has been providing products and services to 	2
Bekaert Fencing  Bekaert Fencing fencing bekaert com  From humble beginnings in 1880 manufacturing barbed wire to todays  woven wire Bekaert has grown to be the agricultural industrys premier fencing supplier  40 year Limited Guarantee on our advanced zincaluminum Bezinal coatings	2
Louis E Page Inc Fencing Materials Distributor www louispage com  A wide variety of mesh openings and wire gauges to help you keep out nuisance  Galvanized ZincAluminum and Vinyl Coated products available for Deer 	1
Products  Southwirecom www southwire com categories Southwire is one of the worlds leading manufacturers of Wire and Cable Tools Components and  Bare Aluminum Overhead Transmission  Distribution	2
Sculpting  Armature Wire  AC Moore acmoore com product 104728709 sculpting armature wire Coil bend wrap and manipulate this lightweight and fully pliable aluminum alloy wire into any shape Perfect for creating an internal support structure for clay or 	1
Find an Authorized Dealer www rev a shelf com rev pages find dealer aspx They can be purchased from any of our authorized Kitchen Dealers who will install RevAShelf products for you or They can be purchased through many of 	0
Sign Holders  Vinyl  Wire  Magnetic  Adhesive  Suction  siffron siffron com sign holders Wire Fixture Sign Holders  If you need signage in your retail or general merchandise aisles check out our aisle sign holder line Or perhaps an adhesive sign 	1
Red Brand Fence Agricultural Wire Fencing Materials and Tools www redbrand com  Since 1889 Red Brand has been an American tradition among farms ranches and livestock Our quality fencing is great for keeping your animals safe Learn 	2
Marco Specialty Steel Metal Wire Cloth  Bar Grating  Perforated  www marcospecialtysteel com  We stock thousands of products in various grades Products we fabricate include wire cloth bar grating  expanded  perforated metal Request a quote today	2
Wire Commercial Racking for Retail Wine and Liquor Stores www wineracks com wire commercial racks c 130_27  Products 1  36 of 36  WineRackscom is a dealer for several different lines of quality wire commercial wine racks We offer point of purchase displays to hold 3 or 	1
View All Products www abcsupply com products view all products  ACM All Metal Works Allmet · American Roofing Products · ASC Profiles · ATAS Bridger Steel Central States Metal · Central Steel  Wire Company DBR 	1
PG Joins TerraCycles Loop – an Environmentally Friendly and  www businesswire com news home 20190124005087 en PG Joins TerraCycle%E2%80%99s Loop %E2%80%93 Environmentally Friendly Jan 24 2019   bottle made with lightweight durable aluminum for its shampoo and conditioner  DAVOS SwitzerlandBUSINESS WIREThe Procter  Gamble  will go to the Loop website or Loop partner retailers websites and shop 	0
Dealer Locator  Hunting Coolers Camping Cooler  Grizzly Coolers www grizzlycoolers com find a dealer Use our dealer locator to find Authorized Grizzly Cooler Dealers near you	2
Orion Cooler Dealers  Orion Coolers www orioncoolers com orion cooler dealers  Dealer List We are currently taking orders from specialty outdoor retail stores We are in the process of compiling our dealer list  if you dont see a stocking 	1
Frequently Asked Questions FAQs  RTIC Coolers www rticcoolers com faq We are a direct to consumer internet retailer  meaning we only sell our coolers online	2
Dealer Locator  Canyon Coolers canyoncoolers com pages dealer locator Loading store locator	2
Coolers  Best Price Guarantee at DICKS www dickssportinggoods com products coolers jsp Shop a wide selection of coolers from DICKS Sporting Goods today Find great prices on coolers with our Best Price Guarantee	1
Pelican Cooler Dealer Locator  PelicanCoolerscom www pelicancoolers com pages dealer locator Locate your nearest Pelican Cooler Dealer Remember to always buy from an authorized Pelican Distributor	2
Store Locator  YETI www yeti com en_US find a store html Gift Cards Custom Drinkware · Hard Coolers · Dog Bowls · Corporate Sales This is YETI Our Story · Stores · Stories · Podcasts · Ambassadors · Partners · News	1
Become an Authorized Bison Dealer  Ice Chest Coolers  Coolers  www bisoncoolers com pages dealer locator Interested in selling our Bison ice chests coolers and highend outdoor gear Were always looking for new dealers to to join the herd and carry our products	2
RETAILER SUPPORT  Igloo Coolers www igloocoolers com pages retailer support Contact our retailer service team for assistance with all sales inquires retailwholesale orders quotespricing and other service questions or concerns	2
Coolers  Bass Pro Shops www basspro com shop en coolers Shop Chest  Personal Coolers from the outdoor experts at Bass Pro Shops your 1 source for quality Find Top Brands like Coleman Yeti  more	1
Where to Buy  ICEMULE Coolers icemulecoolers com pages where to buy We made buying an ICEMULE® as easy as carrying one You can find our highperformance soft coolers at hundreds of the best retailers across the country	2
Where To Buy Pelican Elite Coolers  Coolers On Sale www coolersonsale com where to buy pelican elite coolers  Pelican Elite Cooler Blue Pelican coolers are available in some of the most popular department stores such as Walmart Costco or Sams Club They are also 	0
Dealer Locations — Siberian Coolers siberiancoolers com dealer locations An Alpha moves forward when others retreat When Performance and Durability Matter Turn To Siberian ALPHA Series Coolers Proven Beyond SHOP ALL 	2
Upright Single Glass Door Commercial Display Refrigerator  Retail  www amazon com Upright Single Commercial Display Refrigerator dp B07J5NPJZW Amazoncom Upright Single Glass Door Commercial Display Refrigerator  Retail Merchandiser Cooler  14 Cubic Ft Appliances	1
Coolers Retailer In Store www essickair com coolers_retailer_instore Retailers Essick Air Coolers Accessories and Parts may be purchased at many local and national hardware stores or home  garden locations including these 	1
CPU coolers retail noctua at en products cpu cooler retail Having received more than 6000 awards and recommendations from leading hardware websites and magazines Noctuas heatsinks are serving hundreds of 	2
Walgreens Tests Digital Cooler Doors With Cameras to Target You  www wsj com articles walgreens tests digital cooler doors with cameras to target you with ads 11547206200 Jan 11 2019  Walgreens Boots Alliance Inc is testing a technology that embeds cameras sensors and digital screens in the cooler doors in its stores a new 	0
Find a Dealer  Dometic www dometic com en us us find a dealer BROWSE ALL OUR DEALERS AND SERVICE CENTERS	0
K2 Coolers  Real Cold Real Value www k2 coolers com  Find a K2 Dealer near you Search our directory to locate our  “Here at Honey Brake we use our K2 Coolers religiously Being lighter than comparable coolers 	2
Store Locator www coleman com stores  Find a Store Near You The Store Locator is designed to help you find the closest store near you Search within the US  required Zip Code  Radius 15 Miles 	1
Dealers  Cruzin Cooler www cruzincooler com services dealers  Corporate Headquarters Breebb Inc 8003595199 httpswwwcruzincoolercom Online Dealers coolerscooterdirectcom · cruzincoolersofcoloradocom	2
Coolers  Wheeled Coolers  RovR rovrproducts com  RovR Coolers rotomolded wheeled cooler keeps ice to 10 days Innovative award winning wheeled cooler Most feature packed cooler on the market	2
Pelican  The Home Depot www homedepot com b Pelican N 5yc1vZbft 70 Qt Elite Cooler in Tan and Orange 11  Pelican 50 Qt Elite Cooler Americana Blue Red White  New Pelican Elite 30 Qt OD Green with Tan Trim Cooler	0
Find Walkin Coolers  Freezers Dealer  US Cooler www uscooler com blog find a dealer  Find an authorized US Cooler discount dealer and buy walkin coolers  freezers online today Authorize your business to sell walkin coolers  freezers	2
Display Refrigeration Display Coolers  Freezers www webstaurantstore com 13387 merchandising and display refrigeration html Display chilled drinks grabandgo foods ice cream  specialty items w display coolers  freezers Get FAST shipping from WebstaurantStore today	1
Store Locator  Polar Bear Coolers www polarbearcoolers com store locator html Official site of Polar Bear Coolers makers of performance soft sided coolers and backpack coolers Most well insulated soft cooler ever made FDA Food Grade 	2
How 2 Brothers Turned a 300 Cooler Into a 450 Million Cult Brand  www inc com magazine 201602 bill saporito yeti coolers founders roy ryan seiders html Yup except for the coolers They were seeking better options when Ryan spotted an import from Thailand at a local retailer during a break from a trade show	0
THE COOLEST COOLER  FINALLY A COOLER THATS  coolest com  The Coolest Cooler is the only allinone outdoor entertainment solution youll need for tailgating camping boating picnics beach parties barbecues and 	2
OtterBox Venture 45Quart Cooler Hudson 7754462  Best Buy www bestbuy com site otterbox venture 45 quart cooler hudson 5824903 p skuId 5824903 Shop OtterBox Venture 45Quart Cooler Hudson at Best Buy  Not to worry  as one of our most respected retailers were positive that Best Buy should be able 	1
Where to Buy  Phoenix Manufacturing Inc phoenixmanufacturing com where to buy  Evaporative Air Cooling Products and Service  Use the map below to locate local retailers and installers in your area that can help you purchase our products 	2
Dealer Locator – KYSEK kysek com pages dealer locator Dealer Locator © Extreme Cold LLC KYSEK Ice Chest patent pending 753 Airline Dr Ste B Kenner LA 70062 · Our Story · Become a Dealer · Pro Staff · Dealer 	2
Igloo Coolers  Walmartcom www walmart com browse sports outdoors coolers igloo 4125_546956_4128_4547850 YnJhbmQ6SWdsb28ie Products 1  40 of 295  Shop for Igloo Coolers in Camping Gear Buy products such as Igloo 48Qt Island Breeze Cooler Igloo 38 Quart Wheelie  Best Seller	1
USA made hard Coolers  Soft Cooler  Pelican www pelican com us en products coolers Dealer Login · Guarantee of Excellence · Technical Bulletins · California Supply Chain Act · Online Store Returns · Online Store FAQ Discover Survival Stories	2
Walgreens testing instore coolers with IoT ad displays  Retail Dive www retaildive com news walgreens testing in store coolers with iot ad displays 545929  Jan 14 2019  Walgreens reportedly has been testing Internet of Thingsenabled smart displays installed in cooler doors in a Chicago store that are capable 	0
DEALER INQUIRY – ORCA orcacoolers com pages dealer inquiry Please complete the fields below You will receive a personalized response from our Sales Team within 23 business days Online Form  DEALER INQUIRY 	2
Where To Buy  Cooler Master coolermaster com service whereToBuy html Shop all your Cooler Master favorites in our Official Online Stores US  CA · EU · APAC Select your location to view local Cooler Master Partners	2
Igloos Patent Pending Recool Cooler Takes Home Gear Junkies  www businesswire com news home 20190201005443 en Igloo%E2%80%99s Patent Pending Recool Cooler Takes Home Feb 1 2019  Today at the Outdoor Retailer OR Show in Denver Colorado Gear Junkie awarded Igloos latest product “Recool” as its 2019 “Best in Show” 	0
DealerMedia  Mammoth Coolers mammothcooler com dealer media  Model Size Color Photo Links MS12ROV 12 oz Tumbler 12 oz Tumbler MS20ROV 20 oz Tumbler 20 oz Tumbler MS22ROV 22 oz Tumbler 22 oz	2
Buy Coolers  Drinkware  Academy www academy com shop browse coolers  drinkware Academy Sports  Outdoors offers a wide variety of coolers and drinkware Keep your refreshments perfectly chilled by shopping coolers and drinkware online	1
Engel  Coolers  Ice Chests  Target www target com c coolers sports outdoors engel   N 5xt57Zilo6q Shop Target for Engel Coolers you will love at great low prices  Not in stores  Engel 19 Quart 32 Can Leak Proof Odor Resistant Insulated Cooler Drybox 	1
PepsiCo Product Equipment and Displays  PepsiCo Partners www pepsicopartners com equipment Hello Goodness coolers and vending machines are changing the  Starbucks Counter Top Cooler  Image Of Hello Goodness Glass Front Vendor SKU	0
Wine Coolers  Beverage Centers at FergusonShowroomscom m fergusonshowrooms com search wine coolers and beverage centers Shop online at Fergusoncom for the largest selection of instock Wine Coolers  Beverage Centers	1
Cooler Master on Twitter You may want to contact a local retailer to  twitter com coolermaster status 1177013736277590016 Sep 25 2019  Cooler MasterVerified account CoolerMaster We are dedicated to creating innovation that matters  that inspires people to build their own 	0
YETI  Dealers  Home dealers yeti com  Were highly committed to the success of our dealers and are excited that you are interested in joining our authorized dealer network Click here to apply	2
KULA Coolers – BOTE www boteboard com collections coolers KULA Coolers Yeah its round and well why shouldnt it be We figured since all your  The KULA Cooler  Find A Dealer Your Bote could be closer than you 	2
Coolers  Dollar General www dollargeneral com outdoor living coolers html Shop DollarGeneralcom for deals on coolers and lunch boxes  Save time Save money Every day	1
MAGNA COOL — The Worlds First Magnetic Cooler — Retailers www magnacool com retailers Soft Coolers · Magnetic Toolbags · Accessories  Parts · Videos · Retailers Company Information · Reviews  Retailers People who love us Amazoncom 	2
Zero Zone Inc  The Responsive Company www zero zone com  Jul 23 2019  Zero Zone is a leading manufacturer of refrigerated display cases freezers  coolers and refrigeration systems for food retail commercial and 	2
Monsoon Tropical Island Vodka Cooler Promotions monsooncooler com  page_id 8 Check out the fun summer promotions from Monsoon Tropical Island Vodka Coolers  area where you work or live and well let you know the nearest retailer	2
Canon Room Air Coolers and Touch Air Cooler Retailer  www indiamart com jaspal electrical  NewJaspal Electricals  Canon Room Air Coolers Touch Air Cooler  Diet Air Coolers Retailer from Chandigarh India	1
Wine Refrigerators  Coolers www frys com category Outpost Appliances Wine+Refrigerators+ +Coolers  Shop Fryscom for Wine Refrigerators  Coolers  Soleus WK6 Single Zone 36 Bottles Wine Cooler Reversible Doors Black Color Frys  8716881	1
RTIC Outdoors  Home  Facebook www facebook com rticoutdoors  PagesBusinessesShopping  RetailOutdoor  Sporting Goods CompanyRTIC Outdoors English US · Español · Português Brasil · Français France · 	0
Bryant Air Conditioners Furnaces Heating  Cooling www bryant com en us  Bryant Heating  Cooling offers heating and air conditioning systems to meet your needs Learn more about our products and find a dealer near you	2
Shop Drinkware  Libbey Retail retail libbey com product category category drinkware  17 oz Cobalt Cooler 3999 Add to Libbey Cart  4 pc Blue Ribbon Cooler 2499 Add to Libbey  4 pc Impressions Colors Cooler Set 2499 Add to Libbey 	1
Leer Inc Indoor and Outdoor Ice Vending Merchandisers www leerinc com  Leer is the worlds leading manufacturer of ice merchandisers walkin coolers refrigerated transports and other custom cooling applications	2
Price Tag Holder for Freezer  Cooler Shelf Strips  DGS Retail www dgsretail com C742 Plastic Label Holders for Freezer and Cooler Shelves  Buy price tag molding plastic label holders and data info strips for cooler freezer shelves Wide selection fits doublewire shelves  single wire shelves from 	1
