Where to Buy your Pfister Faucets  Parts Local  Online Store  www pfisterfaucets com where to buy Find a local store or online retailer for Pfister faucets and parts	2
Bathroom Faucets  Bathroom Sink Faucets  Kingston Brass www kingstonbrass com cat bathroom faucets  Shop Kingston Brass for the largest selection of Bathroom Faucets in 100s of  Brass KB1601AL Heritage 4 Centerset Lavatory Faucet with Retail PopUp 	2
Faucet Depot  Kitchen Faucets Bathroom Faucets Sinks  www faucetdepot com  Faucet Depot is a leading retailer of kitchen faucets bathroom faucets sinks showers and plumbing supplies from Kohler Moen Insinkerator Pfister Grohe 	1
Kitchen Faucets  Kitchen Sink Faucets at Ace Hardware www acehardware com departments plumbing faucet and faucet repair kitchen faucets 140 items  Shop Kitchen Faucets at acehardwarecom and get Free Store Pickup at your neighborhood Ace Buy Online  Pickup Today See Details	1
Faucets Kitchen Faucets Bathroom Faucets Sinks and Plumbing  www faucet com  Shop online for thousands of faucets sinks bathroom kitchen and shower fixtures FREE SHIPPING on most items Same day shipping on in stock items	1
Elements of Design EB1602AL 4Inch Centerset Lavatory Faucet  www eodfaucet com product elements of design eb1602al 4 inch centerset lavatory faucet with retail pop up polished brass The Heritage 4Inch Centerset Bathroom Faucet with Retail PopUp and its featured sturdy brass construction and premium polished brass finish are guaranteed 	2
Moen  Bathroom  Kitchen Faucets Shower Heads Accessories  www moen com  Shop a Wide Selection of Kitchen Faucets Bathroom Faucets Shower Fixtures Accessories Lighting and More at Moencom Buy it for looks buy it for life®	1
Luxury Bath and Kitchen  Complete Design Designation  www waterworks com us_en Highend faucets fittings bathtubs washstands stone tiles lighting hardware  more Shop online or find a showroom near you	1
Faucets for bathroom shower and kitchens  hansgrohe USA www hansgrohe usa com  Faucets and showers for the qualityconscious At hansgrohe you will find premium products for bathrooms and kitchens in modern design that will make your 	2
Luxury Kitchen and Bathroom Faucets Made in Brooklyn  watermark designs com  Brooklyn based manufacturer of luxury faucets showers and bath accessories designed by world renown architects and designers We specialize in 	2
Water Saving Magellan Mini Widespread Lavatory Faucet Retail  www houzz com products magellan mini widespread lavatory faucet retail pop up oil rubbed bronze prvw vr~63262193 With graceful curves and lines the Kingston Brass Magellan Mini Widespread Lavatory Faucet features solid brass construction for outstanding performance 	1
Wholesale And Retail Polished Chrome Brass Bathroom Basin  www pinterest com pin 432345632958711650  Free Shipping Wholesale And Retail Polished Chrome Brass Bathroom Basin Faucet Waterfall Spout Vanity Sink Mixer Tap	0
Taps  mixers for bathrooms showers and kitchens  hansgrohe INT www hansgrohe com  Whats right for you Check out our range of products Taps and mixers for wash basins showers and bath tubs Showers such as hand showers and overhead 	1
Faucet Parts for Kitchen Faucets Bathroom Faucets  Shower  www ferguson com category plumbing parts supplies faucet parts _ N zbq4h3 Shop faucet parts for all top brands from bathroom faucet parts to kitchen faucet parts and more online at Fergusoncom	1
American Standard Bathroom and Kitchen Fixtures  Toilets Faucets  www americanstandard us com  For over 140 years American Standard has led the way in developing innovative bathroom and kitchen products including high performance toilets stylish 	2
Wholesale And Retail Modern Classic Waterfall Bathroom Faucet  m dhgate com product wholesale and retail modern elegant brushed 259631885 html Wholesale cheap single handle single hole basin faucet brand wholesale and retail modern classic waterfall bathroom faucet single handle mixer deck 	1
GROHE Kitchen Faucets Bath Faucets  Fixtures at Lowes www lowes com b grohe html Shop GROHE faucets and fixtures from kitchen and bathroom faucets to shower heads and GROHE parts Browse GROHE collections like Ladylux and Atrio	1
2019 Wholesale And Retail Free Shopping Copper Basin Faucet  m dhgate com product wholesale and retail copper basin faucet 371121420 html Wholesale cheap basin faucet brand wholesale and retail free shopping copper basin faucet kitchen  bathroom faucet single hole of cold faucet retro style hat 	1
Kingston Brass Royale Widespread Bathroom Faucet with Retail  www wayfair com home improvement pdx kingston brass royale widespread bathroom faucet with retail pop up drain kbbb1639 html Youll love the Royale Widespread Bathroom Faucet with Retail PopUp Drain at Wayfair  Great Deals on all Home Improvement products with Free Shipping 	1
Kallista Live Artfully www kallista com  KALLISTA offers luxury designer faucets and fixtures in a variety of traditional transitional and modern styles to outfit any bathroom or kitchen	2
China Basin Faucet Seller  Chinese Bathroom Accessory Store from  www dhgate com store 19937217 Luxbath online store sells basin faucetbathroom accessorykitchen faucet on DHgatecom the reliable store with quality service in China	1
KOHLER  Toilets Showers Sinks Faucets and More for Bathroom  www us kohler com us  Explore KOHLER toilets faucets sinks showers and other kitchen and bathroom products Find and buy  a 20500 bath makeover KOHLER Signature Stores 	2
Peerless Faucet www peerlessfaucet com  Finding the right product at the right price doesnt have to be complicated Peerless faucet and bath products make it easy to get exactly what you need	2
Bathroom Faucets  Kens Plumbing  Heating www kensplumbingandheating com plumbing products bathroom faucets  Coralais® Singlehandle centerset bathroom sink faucet with metal popup drain and lift rod 15500 Manufacturer Suggested Retail Price Coralais Sink 	1
Stern Engineering Ltd  Home www sternfaucets com  Touch Free Lavatory faucets  Touch Faucets Touch Green Time Perfect Time Trendy Touch Tubular Touch Cool Touch Free Wall Mounted Faucets	2
Automatic  Sensor Bathroom Sink Faucets  Sloan www sloan com commercial bathroom products faucets Sloan touchless faucets enhance any commercial restroom sink Battery solarpowered or  Locate a distributor or sales rep in your area Find a dealer 	2
Scandvik Marine Faucets the Best Marine Faucets Available High  www scandvik com  Scandvik offers Marine Faucets sorted by Faucet Families and by Marine Faucets types Scandvik sells the best Marine Faucets Available	2
Modern Bathroom Shop Bathroom Vanities Sinks Showers Tubs  www modernbathroom com   up to 70 online at Modern Bathroom browse our collection of bathroom vanities faucets sinks  We are authorized retailers of the industrys best brands	1
Stainless Steel Faucets  stainless steel kitchen faucet  black  mgstaps com en  MGS stainless steel fixtures merge Italian luxury and style with the innovative precision of Swiss engineering creating slim silhouettes and simple shapes that 	2
DCode Handrinse basin 070650  Duravit www duravit us products all_series d code us en html product 94766 The key to a wonderfully comfortable bathroom The products of DCode by  faucet hole on right side 1 faucet hole punched 07065000082 p  Retailer contact	2
DCode Handrinse basin 070650  Duravit www duravit us products all_series d code us en html product 94766 The key to a wonderfully comfortable bathroom The products of DCode by  faucet hole on right side 1 faucet hole punched 07065000082 p  Retailer contact	2
AF Supply  Kitchen bath hardware HVAC and plumbing systems www afsupply com  AF Supply is a leading distributor of bath kitchen plumbing and heating supplies  Danze D455557 Opulence Single Handle PullDown Kitchen Faucet 	1
SinkPositive TouchFree WaterSpace Saving Adjustable Toilet Tank  www homedepot com p SinkPositive Touch Free Water Space Saving Adjustable Toilet Tank Retrofit Sink Faucet Basin White HD214 01 205088518 Best Seller  The SinkPositive touchfree sinkfaucet basin replaces your toilet tank cover and uses fresh water from the supply line to enable hand washing 	1
Kingston Brass Royale Mini Widespread Bathroom Faucet with  www walmart com ip Kingston Brass Royale Mini Widespread Bathroom Faucet with Retail Pop Up Drain 32046135 Free Shipping Buy Kingston Brass Royale Mini Widespread Bathroom Faucet with Retail PopUp Drain at Walmartcom	1
GROHE  The Home Depot www homedepot com b GROHE N 5yc1vZ3zn Centerset SingleHandle Bathroom Faucet in Starlight Chrome  GROHE Veletto SingleHandle PullDown Dual Sprayer Kitchen Faucet with Soap Dispenser 	1
AAA Distributor Philadelphia Wholesale Kitchen Bathroom  Flooring www aaadistributor com  AAA Distributor help you with your entire kitchen bathroom  flooring needs in Philadelphia PA and surrounding areas Call at 12157457900	1
QA The Difference Between Retail and ContractorGrade Faucets  mosbybuildingarts com qa the difference between retail and contractor grade faucets  Question Were getting ready to remodel our bathroom and picking out fixtures Theres a great price difference between faucets on the shelf at Home Depot or 	0
Snyder Diamond  Decorative Plumbing Decorative Hardware  www snyderdiamond com  Snyder Diamond is a family owned Decorative Plumbing Decorative Hardware Kitchen Appliances store located in Santa Monica CA We offer the best in 	2
Stainless Steel Sinks and Faucets for Kitchens and Baths www mrdirectint com  MR Direct is a leading supplier of kitchen sinks and faucets We sell undermount sinks stainless steel sinks stainless kitchen sinks topmount sinks bathroom 	2
ROHL Home  bringing authentic luxury to the kitchen and bath www rohlhome com  ROHL Collection brings authentic luxury to the kitchen and bath Every faucet fixture and accessory is designed by acclaimed architects and craftsman and is 	2
Where to Buy GROHE Products  GROHE www grohe us en_us our service where_to_buy  The listed authorized online sellers carry the official GROHE Authorized Seller distinction  In the market for a new faucet or shower Have questions about 	2
VIGO Industries  Showers Sinks Faucets for your Bathroom and  www vigoindustries com  Vigo offers a variety of showers sinks vanities bathroom and kitchen faucets We at Vigo combine style and quality to deliver the best product for your needs	2
Kitchen and Bathroom Plumbing Fixtures  Gerber Plumbing www gerberonline com  Since 1932 Gerber plumbing has been manufacturing professional bathroom kitchen and commercial plumbing fixtures View all products and finishes online	2
Krowne Metal Corporation Underbar Sinks Refrigeration Faucets  krowne com  Krowne is a leading US manufacturer and supplier of stainless steel underbar equipment backbar refrigeration foodservice faucets gas hoses hand sinks 	2
Symmons Commercial  Residential Kitchen  Bath Products www symmons com  Since 1939 Symmons Industries has been a premier manufacturer of innovative commercial and residential kitchen and bath plumbing products	2
How to Replace a Kitchen Faucet  PlanItDIY www planitdiy com how to plumbing how to replace a kitchen faucet  A new faucet is a great way to give a fresh look to a kitchen or bathroom Your local independent home improvement retailer has a variety of styles to choose 	0
Sigma Faucet www sigmafaucet com   luxury  bespoke custom faucets shower systems  accessories in traditional transitional and contemporary styles for perfect pairing with any bath or kitchen	2
Kitchen Sinks  Costco www costco com kitchen sinks html AFA Stainless Double Bowl 33 Dual Mount Kitchen Sink  Faucet Combo Sign In For Price 21999 AFA Stainless Double Bowl 33 Dual Mount Kitchen Sink 	1
The Somerville Bath  Kitchen Store www thesomervillebathandkitchenstore com  The Somerville Bath  Kitchen Store Trained staff is ready to assist you with your selection of plumbing fixtures Our trained professionals will assist you in the 	1
Whitehaus Collection whitehauscollection com  Whitehaus Collection provides you with highend plumbing fixtures that are dynamic elegant longlasting and durable for transforming your kitchen bath and 	2
Symmons Commercial  Residential Kitchen  Bath Products www symmons com  Since 1939 Symmons Industries has been a premier manufacturer of innovative commercial and residential kitchen and bath plumbing products	2
Kitchen Sinks  Costco www costco com kitchen sinks html AFA Stainless Double Bowl 33 Dual Mount Kitchen Sink  Faucet Combo Sign In For Price 21999 AFA Stainless Double Bowl 33 Dual Mount Kitchen Sink 	1
hansgrohe AU Taps  mixers for bathrooms showers and kitchens www hansgrohe com au  Showers such as hand showers and overhead showers showerpipes and shower systems Kitchen products such as kitchen taps kitchen sinks and combi units 	2
The Somerville Bath  Kitchen Store www thesomervillebathandkitchenstore com  The Somerville Bath  Kitchen Store Trained staff is ready to assist you with your selection of plumbing fixtures Our trained professionals will assist you in the 	1
Whitehaus Collection whitehauscollection com  Whitehaus Collection provides you with highend plumbing fixtures that are dynamic elegant longlasting and durable for transforming your kitchen bath and 	2
Products www dornbracht com en us products  Kitchen  Authorized Retailer complete address or City State This site uses cookies and other tracking technologies to assist with navigation and your ability 	2
Danze Home www danze com  Danze® by Gerber Expands Product Offering with PullDown Prep Faucets to Complement Decorative Kitchen Collections	2
Strom Plumbing by Sign of the Crab  Wholesale Plumbing Products signofthecrab com  Strom Plumbing wholesale plumbing products combine traditional style with modern technology View our collection of solid brass faucets tubs  accessories	1
Speakman Home speakman com  Speakman Company produces high quality showering emergency equipment and plumbing products	2
Best Faucet Buying Guide  Consumer Reports www consumerreports org cro faucets buying guide Sep 14 2016  Although there are two main types of sink faucets single lever and  When you shop through retailer links on our site we may earn affiliate 	0
European Kitchen and Bathworks Kitchen  Bathroom Plumbing  www eurokbw com  European Kitchen and Bathworks is a family owned Kitchen and Bathroom Plumbing Supply and Remodeling store located in Atlanta GA  Shop Faucets	2
Home  TotoUSAcom www totousa com  Drake® 1G WASHLET® Toilet The Drake toilet features the DYNAMAX TORNADO FLUSH® system It combines powerful bowl cleaning and waste evacuation 	2
Faucet Warehouse  Warehouse prices on faucets sinks  www faucet warehouse com  Kitchen View Products latest image  c 2019 Faucet Warehouse All Rights Reserved  Privacy Policy  Terms and Condition Close Checkout as a new 	1
TS Brass Top Selection of Faucets and Plumbing Parts  TS Brass www tsbrass com  Narrow down your search by looking for products specific to your market segment View All Markets · Restaurant · Education · Healthcare · GroceryRetail	1
KALDEWEI www kaldewei com  Kaldewei offers bath shower and whirlpool tub in the avantgarde versions ambience and advantage	2
Hudson Reed USA Bathroom Showers Designer Radiators Luxury  usa hudsonreed com  Bathrooms showers faucets and designer radiators for creating your luxurious bathroom and kitchen Our huge range includes FREE SHIPPING with all our 	1
Dealer Locator www franke com us en ks support where to buy dealer locator html  Dealer Webshop · About us · Where to buy · Franke Americas · Search · 0 · 0 · Franke Logo More results Products Sinks Faucets Filtration Kitchen Solutions	2
Buildcom Smarter Home Improvement  Plumbing Lighting HVAC  www build com   Customer Service 7 Days a Week and FREE shipping offers on Faucets Lighting Door Hardware Venting Appliances and much more  Bathroom Lighting	1
Faucet Direct – Your Online Faucet Showroom www faucetdirect com  Faucet Direct is an online faucet showroom specializing in faucets Faucet experts available  Bathroom Kitchen Faucets Showers Sinks Accessories Lights	1
Retail Food Establishment Plan Review Form www tchd org DocumentCenter View 2094 S 385 RFE Plan Review_140122_svalera bidId  A separate application form and fee must be submitted for each kitchen and concession  Unless the operation is exempt from licensing by the Colorado Retail Food  Selfdispensing springloaded or metering faucets must provide a flow	0
Wolverine Brass  High Quality Plumbing Products Made for  www plumbmaster com wolverinebrass   products including kitchen faucets bathroom faucets shower fixtures faucet parts  Plumbmaster is now the exclusive distributor of Wolverine Brass products	1
B  C Custom Hardware  Decorative Plumbing Hardware Kitchen  www customhardware net  Come in to our showroom today to see our fine collection of faucets kitchen sinks bathroom sinks bathtubs toilets bathroom accessories hardware cabinet 	1
Californias Title 20 Water Efficiency Standards info amconservationgroup com blog california title 20 water efficiency standards Jan 24 2018  Also California distributors wholesalers and retailers are able to sell noncompliant residential lavatory faucets and shower devices they had in 	0
Wholesale Sinks  Faucets  Toilets  Tubs  Quartz Surfaces  www pelicansinks com  Wholesale supplier of sinks faucets toilets tubs quartz slabs fabrication tools porelain tile Kitchen sinks bathroom sinks stainless steel porcelain	1
Bathroom Hardware www bedbathandbeyond com store category bath bathroom hardware 13456  Products 1  24 of 968  Beautify your bath or powder room with bath hardware and bath fixtures from BedBathandBeyondcom  shop now to enjoy the best 	1
Decorative Plumbing Distributors  FremontCA www decorativeplumbing com  Decorative Plumbing Distributors Trained staff is ready to assist you with your selection of plumbing fixtures Our trained professionals will assist you in the 	1
Jacquelyn Sullivan v Susan Hutchinson  2004  New York  law justia com cases new york appellate division third department 2004 2004 07878 html  that other local retailers sold bathroom faucets that he was unable to identify the faucet  Plaintiffs evidence concerning the identity of the retailer of the faucet 	0
Belle Aire Deck Mounted Bath Filler in 2019  Pilot  House design  www pinterest com pin 650629477390670158  Options You might decide to put in a bathroom or perhaps a little kitchen in the  RetailLuxury Brass Basin Faucet Deck Mounted Lavabo Mixer Double 	0
Two Handle 4 Centerset Lavatory Faucet With Retail www bhg com shop kingston brass two handle 4 centerset lavatory faucet with retail pop up brushed nickel p345b0f1ed247931e6059fe7381372b95 html Shop hundreds of Bathroom Sink Faucets deals at once Weve got two handle 4 centerset lavatory faucet with retail popup brushed nickel and more	1
Shop Bathroom Faucet  Great deals on Bathroom Faucet on  www aliexpress com promotion promotion_bathroom faucet promotion html 783295 products  Shop our best value Bathroom Faucet on AliExpress  Free shipping Wholesale and Retail Promotion Chrome Brass Waterfall Bathroom 	1
How to Become a Perfume Distributor  Chroncom smallbusiness chron com become perfume distributor 19102 html If you love fragrances and want to be involved in the industry learning how to become a perfume distributor can bring about interesting opportunities	0
locate – kai fragrance kaifragrance com pages locate find a retailer we recommend contacting the store prior to shopping to make sure they carry the kai product youre looking for Store Locator is loading from 	2
Womens Perfume  Mens Cologne  Discount Perfume at  www perfumania com  Save up to 70 off top designer fragrance brands when you shop at Perfumania We have a large selection of womens perfume mens cologne eau de toilette 	1
online retailers – kai fragrance kaifragrance com pages online retailers to find an online retailer use the listing below kai does not endorse any unauthorized retailer sales through amazon ebay or costco nor do we guarantee the 	2
Launching and Growing Canadas Largest Online Fragrance Retailer  www starterstory com fragrancebuy May 6 2018  Fragrancebuy is Canadas largest online fragrance retailer We give fragrance enthusiasts access to a variety of discounted designer  niche 	1
Fragrance retailer with local store files for bankruptcy protection  www ibj com articles 65189 fragrance retailer with local store files for bankruptcy protection Aug 29 2017  Fragrance seller Perfumania has filed for bankruptcy protection and plans to close 65 of its 230 stores as it focuses more on selling online	0
Fragrance retailer uses AI to manage price and promotions  www chainstoreage com technology fragrance retailer uses ai to manage price and promotions internationally  Aug 14 2018  Douglas is creating a new pricing strategy that focuses on its customer segments even those in other countries Fragrance retailer Douglas is 	0
Store Locations www nestfragrances com store locator 4 days ago  NEST Fragrances is a leading lifestyle fragrance brand offering a variety of exceptional personal care home fragrance and fine fragrance collections specifically designed to enhance ones  Find a NEST Fragrances Retailer	2
Wholesale Perfume Directory www wholesalecentral com Perfume html WORLDWIDE PERFUMES PERFUME MARKET Miami Florida United States Wholesale distributor of Genuine Brand Name Perfumes Top selling fragrances 	1
The Perfume Shop  Wikipedia en wikipedia org wiki The_Perfume_Shop The Perfume Shop is a United Kingdom perfume retailer founded in 1992 The company was acquired by the worlds largest health and beauty retailer AS 	1
Sephora Smelt It Blippy Dealt It Fragrance Retailer Takes Shopping  techcrunch com 2010 10 26 blippy sephora  Oct 26 2010  Blippy has partnered with Sephora to create a version of Blippy specifically tailored to the fragrance and beauty retailers brand From here 	0
Fragrance Outlet www fragranceoutlet com  Fragrance Outlet is one of the nations largest retailers with over 100 Stores of genuine designer fragrances including Calvin Klein Dior Gucci and more	1
The Science of Smell How Retailers Can Use Scent Marketing to  www shopify com retail the science of smell how retailers can use scent marketing to make more sales Aug 11 2016  Retail spaces have a lot to consider when creating the right  The floral and citrus fragrance was so popular that the airline gave it a name 	0
Fragrance Retailer Files Chapter 11 With 84MM DIP Commitment  www abladvisor com news 12505 fragrance retailer files chapter 11 with 84mm dip commitment from wells fargo Aug 28 2017  Perfumania Holdings Inc a US specialty retailer and distributor of designer fragrances and related beauty products announced that it has 	0
Perfumania Largest US Fragrance Retailer Dumps Trump www dailykos com story 2015 7 9 1400709  Perfumania Largest U S Fragrance Retailer Dumps Trump Perfumania Largest US Fragrance Retailer Dumps Trump Jul 09 2015 828am PDT by ericlewis0 Community Comment large 46 57 Please log in or sign up 	1
A Pricey but Potent Romantic Fragrance  Perfume Retailer Fred  www latimes com archives la xpm 1991 05 10 vw 1442 story html May 10 1991  A Pricey but Potent Romantic Fragrance  Perfume Retailer Fred Hayman introduces a new sentimentalsounding scent for the 90s   with 	0
Online retailer FragranceNetcom is acquired www digitalcommerce360 com 2018 08 29 online retailer fragrancenet com is acquired  Aug 29 2018  “FragranceNetcom has a strong reputation as an online discount fragrance retailer which combined with its customer base with a high 	0
Fragrance  Sephora www sephora com shop fragrance Shop fragrances for women and men at Sephora Find your favorite perfume or cologne or accentuate your style with a new scent	1
Perfume Cologne  Discount Perfume www fragrancenet com  Find discount perfume discounts on leading brands of cheap womens perfumes mens colognes skin care and hair care products	1
Target touts exclusive fragrance Umbro partnership  Retail Dive www retaildive com news target touts exclusive fragrance umbro partnership 515123  Jan 19 2018  Target on Thursday announced an exclusive fragrance line dubbed Good Chemistry as well as a line of kids sports apparel through a 	0
Following the Scent of More Perfume Sales  The New York Times www nytimes com 2016 10 03 fashion fragrance duty free retail html Oct 3 2016  Fragrance brands and dutyfree retailers hope targeted offerings will revive interest among global travelers	0
Target touts exclusive fragrance Umbro partnership  Retail Dive www retaildive com news target touts exclusive fragrance umbro partnership 515123  Jan 19 2018  Target on Thursday announced an exclusive fragrance line dubbed Good Chemistry as well as a line of kids sports apparel through a 	0
Fragrance Spice Online Retailer Celebrates Launch of New Website  www prnewswire com news releases fragrance spice online retailer celebrates launch of new website with 15 percent off storewide coupon for first time customers 300755322 html Nov 26 2018  PORTLAND Ore Nov 26 2018 PRNewswire  Fragrance Spice httpswwwfragrancespicecom recently revamped their perfume and 	0
Ulta Beauty Cosmetics Fragrance Skincare and Beauty Gifts www ulta com  ULTA Beauty offers customers prestige  mass cosmetics makeup fragrance skincare bath  body haircare tools  salon bareMinerals Smashbox Murad 	1
Thymes Store Locator  Sold in over 4000 Locations www thymes com Store Locator  Since Thymes offers such a wide array of fragrance collections product selection may vary from store to store If youre looking for a specific fragrance we recommend you call the store you plan to visit to  4 Specialty Retailers In Your Area 1	1
Perfume Cologne  Discount Perfume www fragrancenet com  Find discount perfume discounts on leading brands of cheap womens perfumes mens colognes skin care and hair care products	1
