Find a Retailer  Gendarme Fragrances gendarme com company find a retailer  Find a Retailer · Authorized Websites · Customer Care · FAQs · Return  Exchange Policy · Home · Cart · Checkout · Company · About Us · Authorized Websites 	2
Retailers  My Daughter Fragrances  EcoLuxe Scents mydaughterfragrance com pages retailers You can find our fragrances at the following retailers If youd like to become a retailer for My Daughter Fragrances wed love to hear from you	2
Trying Most Affordable Online Fragrance Retailer  My Favorites  m youtube com watch v Pp5Up7_7IO4 Sep 23 2019  Trying Most Affordable Online Fragrance Retailer  My Favorites 838 views 71 3 Share Save Report Flowerbomb31 373K subscribers	0
Mall Cribbs on Twitter Congratulations to ThePerfumeShop who  twitter com mallcribbs status 1003577121917239296 Jun 4 2018  Embed Tweet Congratulations to ThePerfumeShop who won National Fragrance Retailer of The Year at the TFFAwardsUK 	0
BRIEF Motherhood Maternity Closing Canadian Stores Spanish  www retail insider com retail insider 2019 10 brief motherhood maternity closing canadian stores spanish fragrance retailer to enter canada pilgrim arlene dickinson shutter professionals costco business centre 4 days ago  We also promote the refill system for our fragrances to minimize our impact  New retailers will include Samsung Ernest Change Lingerie and 	0
How Sephora is leveraging AR and AI to transform retail and help  www techrepublic com article how sephora is leveraging ar and ai to transform retail and help customers buy cosmetics  Feb 15 2018  Beauty retailer Sephora followed customer technology trends to  with AI and sampling a fragrance via a touchscreen and scented air Further 	0
Retail www ambius com scenting case studies retail  Discriminating consumers respond to retail spaces that are both fun and inviting When a scented fragrance is added to the shopping experience consumers	0
Americas largest fragrance retailer Locations Location Address  www creativejobscentral com americaslargestfragranceretailer Directory of Americas largest fragrance retailer Locations Careers Address HR  Creativejobscentral Get locations addresses hr and human resources 	1
Trying Most Affordable Online Fragrance Retailer  My Favorites  www youtube com watch v Pp5Up7_7IO4 Sep 23 2019  Hey Dandelions USE CODE FLOWERBOMB20 for 20 off httpbitlyREBLxFlowerbomb31 Live ColorFully httpbitlyLiveColorFully 	0
Scenting Retail Stores and Fashion Brands  Air Aroma www air aroma com scenting retail In retail environments candles can be dangerous and perfume sprays can be costly and inefficient For an even and consistent level of scent throughout your 	1
Discount Perfume  Cologne  Buy Fragrances Online  Perfumecom www perfume com  Check out Americas leading online store for discount fragrances and discount perfumes  Free shipping on thousands of fragrances Save up to 80 off retail	1
LuxuryPerfume Makers Turn to WalMart Target  WSJ www wsj com articles luxury perfume makers turn to wal mart target 1443226316 Sep 25 2015  Designer fragrances typically sold at US department stores and specialty retailers are becoming popular items at retailers such as WalMart 	0
Manager Marketing Estee Lauder Makeup  Fragrance Travel  www linkedin com jobs view manager marketing estee lauder makeup fragrance travel retail worldwide at stella ai 1409751744 Manager Marketing Estee Lauder Makeup  Fragrance Travel Retail Worldwide StellaaiNew York City NY US 2 months ago Be among the first 25 applicants	0
What Retail Buyers Want Cosmetics Fragrance  Bath  ECRM ecrm marketgate com Blog 2017 09 What Retail Buyers Want Cosmetics Fragrance  Bath Sep 24 2017  As part of their preparation for ECRMs 60 EPPS meetings retail buyers complete a form on the EPPS prep site indicating the subcategories 	0
Best 7 Wholesale Perfume Suppliers in USUKChina www chinabrands com dropshipping article best wholesale perfume suppliers 14594 html Oct 22 2018  •There are varying levels of standards and selling angles by imitation perfume online sellers Many of them are not authorized retailers for the 	2
Scenting Retail Stores and Fashion Brands  Air Aroma www air aroma com scenting retail In retail environments candles can be dangerous and perfume sprays can be costly and inefficient For an even and consistent level of scent throughout your 	1
LuxuryPerfume Makers Turn to WalMart Target  WSJ www wsj com articles luxury perfume makers turn to wal mart target 1443226316 Sep 25 2015  Designer fragrances typically sold at US department stores and specialty retailers are becoming popular items at retailers such as WalMart 	0
Discount Perfume  Cologne  Buy Fragrances Online  Perfumecom www perfume com  Check out Americas leading online store for discount fragrances and discount perfumes  Free shipping on thousands of fragrances Save up to 80 off retail	1
Manager Marketing Estee Lauder Makeup  Fragrance Travel  www linkedin com jobs view manager marketing estee lauder makeup fragrance travel retail worldwide at stella ai 1409751744 Manager Marketing Estee Lauder Makeup  Fragrance Travel Retail Worldwide StellaaiNew York City NY US 2 months ago Be among the first 25 applicants	0
Trapp Candle  Retailer Signup www trappcandles com retailer_signup aspx Trapp Fragrances is dedicated to the independent retailer more info   We appreciate your interest in becoming a Trapp retailer Please complete this form 	2
What Retail Buyers Want Cosmetics Fragrance  Bath  ECRM ecrm marketgate com Blog 2017 09 What Retail Buyers Want Cosmetics Fragrance  Bath Sep 24 2017  As part of their preparation for ECRMs 60 EPPS meetings retail buyers complete a form on the EPPS prep site indicating the subcategories 	0
Shopping campaigns with partners  Google for Retail www google com retail solutions shopping campaigns with partners  For brands Work with every one of your eligible retailer partners to fund  a top retail partner to increase clickshare of promoted designer fragrances click share 	
BECOME A RETAILER – Bs Knees Fragrance Co bsknees com wholesale policies  If you are interested in becoming a wholesaler please fill out the form and we will get right back to you A valid tax ID number is required Credit card andor 	2
Trapp Fragrances  Its all about the fragrance trappfragrances com  At Trapp its all about the fragrance Thats why we guarantee every product will fill a room with fragrance within minutes  View More Find a Trapp Retailer 	2
Job Detail  Retail Fragrance Sales  Counter Manager Full Time  www macysjobs com Search JobDetail Retail Fragrance Sales  Counter Manager Full Time Brooklyn Downtown Brooklyn NY 710147605 Oct 24 2019  The Fragrance Counter Manager is responsible for supervising the complete operations of the fragrance line to ensure a high level of 	0
RETAIL DIRECTOR  Luxury Fragrance Company  180200K in  stylecareers com job retail director luxury fragrance company 180 200k new york new york 141257 A Luxury Fragrance Company is seeking a creative and driven Retail Director to join their team in New York City In this integral role you will put your skills and 	0
Selfridges Distills Your Persona Into A Scent In Its Interactive Fragr www fastcompany com 3030380 selfridges distills your essence into a scent in its interactive fragrance lab May 9 2014  Your character distilled as scent is the unusual promise being made by UK retailer Selfridges to those who visit the justlaunched Fragrance 	0
ULTA SALON COSMETICS  FRAGRANCE INC ULTA  www liptonfinancialservices com 2015 12 ulta salon cosmetics fragrance inc ulta reports thursday pm can this best of breed retailer deliver  Dec 2 2015  As described in “RestaurantsRetail – Why Bother” the restaurant and retail industries provide a leading indicator of far broader economic 	0
Perfume and Fragrance  Macys www macys com shop makeup and perfume perfume id 30087 Shop Macys large variety of perfumes from the most popular fragrance brands Find the perfect scent for any occasion FREE shipping on all beauty purchases	1
PHLUR Reinvents Fragrance Shopping Experiences  PYMNTScom www pymnts com news retail 2017 phlur perfume retail innovation  Oct 24 2017  After finding fragrance shopping to be too overwhelming and tedious  particularly at department store counters and in specialty retailers like 	0
Retail Locator Aromatique Decorative Fragrance Candles  www aromatique com Retail Locator Shop Aromatique the Creator of Decorative Fragrance Find a wide variety of fragrance lines including candles diffusers  decorative  Retail Locator 	2
Behind the Spritz What Really Goes Into a Bottle of 100 Perfume  www aol com 2012 05 22 celebrity perfume cost breakdown  May 22 2012  How much does that fancy 100abottle department store perfume you wear really cost to make The answer is one of the retail industrys dirty 	0
fragrance  PSFK  Retail  CX Innovation Intelligence www psfk com tag fragrance Retail  CX innovation and trends insights on the topic of fragrance	1
The Fragrance App  Fragrances of the World www fragrancesoftheworld com FragranceApp Both a sales and training tool our retail App puts a wealth of knowledge at your  database the App will guide your customers through their fragrance journey	0
retail  sen7  fragrance atomizer refillable for all fragrances www sen7 com en us retail  worldwide retail sen7 is available from many specialist retailers around the world Select your country and find a store near you Please select a country ×	1
Perfumania at South Shore Plaza®  A Shopping Center in Braintree  www simon com mall south shore plaza stores perfumania Perfumania located at South Shore Plaza® Americas Largest Fragrance Retailer Perfumania specializes in the sale of genuine designer fragrances bath and 	1
Retail  Rezaroma  fragrance your business rezaroma com retail Retail Brand awareness the minute customers walk in Scientific studies have  a pleasant fragrance environment complements the shopping experience	2
Is there a digital solution for fragrance retail Scent Trunk www cosmeticsdesign com Article 2017 03 07 Is there a digital solution for fragrance retail Scent Trunk Mar 7 2017  The newly launched Scent Trunk thinks so And the team behind this online custom fragrance maker believes theyve got it Cosmetics Design 	0
Londons Top 10 Perfume Shops www tripsavvy com top ten london perfume shops 1583068 May 13 2019  If you love fragrances theres plenty to sniff at in London From Englands oldest perfume retailer to a store that supplies the royal family weve 	1
BECOME A RETAILER – Blind Barber blindbarber com pages become a retailer BECOME A RETAILER Blind Barber 339 East 10th St New York NY 10009 2122282123 · infoblindbarbercom Name Email Company Message Sign up 	2
Retail  BW Confidential www bwconfidential com category retail  Retail insights from BW Confidentials Beauty Insight n°196  UKbased fragrance retailer The Perfume Shop is to open its first experiential concept store on 	0
Store Locator  La Tee Da Fragrance ltdfragrance com where to purchase  Use the Store Locator to find a retailer near you Just enter your zip code or your address in the address line select radius to search and press enter If you are 	2
How to Become a Perfume Distributor careertrend com how to become a perfume distributor 13646438 html Aug 27 2019  Being a perfume distributor will give you the ability to work from home by selling on the Internet or through small local retail shops Best of all 	0
Teen retailer AbercrombieFitch sues Beyonce over plan to sell a  www metro us news teen retailer abercrombiefitch sues beyonce over plan to sell a sasha fierce fragrance tmWiip   8fobXL25wK2s Sep 16 2009  COLUMBUS Ohio  Teen clothing retailer AbercrombieFitch Co is suing singer Beyonce Knowles over her plans for a fragrance named after 	0
Stafford  The Fragrance Shop  Guildhall Shopping Centre www guildhallstafford com the fragrance shop Established in 1994 The Fragrance Shop is the UKs largest independent fragrance retailer With over 175 stores nationwide showcasing over 130 soughtafter 	1
Become a Xyrena Retailer  Xyrena xyrena com become a retailer  Dont think fragrance is a fit for your business Think again Xyrenas unisex products arent the boring offerings youd expect to find in department stores	2
Aroma Retail 4 oz Fragrance Oil Refill  Asian Garden   Amazoncom www amazon com Aroma Retail Fragrance Oil Refill dp B07P1719C7 Buy Aroma Retail 4 oz Fragrance Oil Refill  Asian Garden Experienced at Aria City Center Lobby MGM Grand Hotel  Luxor Hotel Las Vegas Home Fragrance 	1
AMERIKAS  Fragrance Perfume Health  Beauty Distributor USA www amerikas com  Amerikas is one of USAs top distributors of fragrances perfumes cosmetics and health  beauty products	1
The Perfume Shop www digitalgenius com casestudy the perfume shop  Founded in 1992 The Perfume Shop is the UKs largest specialist fragrance retailer with over 260 stores nationwide They sell all major designer fragrance 	1
Perfumania at Pleasant Prairie Premium Outlets®  A Shopping  www premiumoutlets com outlet pleasant prairie stores perfumania Perfumania located at Pleasant Prairie Premium Outlets® Americas Largest Fragrance Retailer Perfumania specializes in the sale of genuine designer 	1
Perfume etailer finds sweet smell of success in Nordic market  www bring com content articles perfume e tailer finds sweet smell of success in nordic market Apr 7 2017  Its a philosophy that has brought success to the Manchesterbased online fragrance retailer From a humble start in 2009 Perfume Click has 	0
Dollar Shave Club dabbles in fine fragrance and retail  Global  www globalcosmeticsnews com dollar shave club dabbles in fine fragrance and retail  Nov 9 2018  Dollar Shave Club dabbles in fine fragrance and retail Dollar Shave Club has announced the launch of a new mens fragrance range Blueprint 	0
Retail  Perfumania Holdings perfumaniaholdings com fragrance brands perfumania retail  Perfumania Retail Americas largest fragrance retailer Perfumania is a leading specialty retailer offering a wide range of brand name and designer fragrances	1
Macys Macys Seasonal Retail Cashier Fragrance Counter Interview  www glassdoor com Interview Macy s Interview Questions E1079 htm filter jobTitleExact Macy%27s+Seasonal+Retail+Cashier+Fragrance+Counter Dec 13 2014  1 Macys Macys Seasonal Retail Cashier Fragrance Counter interview questions and 1 interview reviews Free interview details posted 	0
Loews Hotels Bright Sunshine  Aroma Retail aromaretail com shop fragrances resort fragrances loews hotels bright sunshine  When looking for Fragrance Diffusion Systems that are durable and longlasting consider Aroma Retail for all of your home fragrancing needs and desires	2
Jo Malone  Interactive Fragrance Display  PERCH — PERCH  The  www perchinteractive com jo malone PERCH won a Clio Award for this fragrance combining cabinet that shows off the best of interactive retail displays	0
Sephoras grade – Ranking retailers on toxic chemicals retailerreportcard com retailer sephora  Sephora also collects a full list of ingredients for its private label products including according to the retailer fragrance ingredients Unfortunately Sephora does 	0
North America  Points of sale  Maison Francis Kurkdjian www franciskurkdjian com america html Our Fragrance House Our story · Our philosophy The fragrance wardrobe À la rose · Amyris · APOM · Aqua Celestia · Aqua Universalis · Aqua Vitae · Baccarat 	0
Carner Barcelona perfume at Parfums Raffy  Carner Barcelona  www parfumsraffy com brand carner barcelona Buy from the complete collection of Carner Barcelona fragrances at Parfums Raffy  Authorized Carner Barcelona perfume retailer	1
Barneys CEO exits as lastditch bid to save retail stores fails nypost com 2019 11 01 barneys ceo exits as last ditch bid to save retail stores fails  9 hours ago  Barneys CEO exits as lastditch bid to save retail stores fails By Francesca Bacardi and  Saudi perfume retailer teams up to buy Barneys 	0
PHLUR  Good Clean Fun phlur com  Discover PHLURs hypoallergenic vegan and crueltyfree clean fragrances crafted by worldclass perfumers using only the best ingredients Try them at home 	2
Store Locator  Fragrances of Ireland www fragrancesofireland com store locator html Fragrances of Ireland  Inis the Energy of the Sea Store Locator Please note that stores may not stock all Fragrances of Ireland products May we suggest a 	1
Taking a look at the trends behind whats impacting sales of mens  www npd com wps portal npd us news press releases 2019 higher concentrations artisanal brands expected to drive growth in mens fragrance sales this fathers day  Jun 5 2019  Mens fragrance sales are up 6 percent compared to 4 percent growth  Coinciding with the National Retail Federation calendar dollar sales 	0
Earth Science Naturals Store Locator Earth Science Beauty earthsciencenaturals com locations html Earth Science products are available at various specialty retail stores natural food markets and wherever ecofriendly beauty products are sold including a wide 	2
Retail Roundup—Kroger scooping up Overstock Target launches  www fierceretail com operations retail roundup kroger scooping up overstock target launches fragrance Jan 23 2018  Kroger is rumored to be in acquisition talks with Overstockcom Target is launching its firstever fragrance and more needtoknow news from 	0
Where to buy an air purifier  Find a store located near you  Blueair www blueair com us store locator  Locate where to buy Blueair air purifiers and filters Shop online or in store choosing from our wide network of retail partners dedicated to cleaner healthier air	2
Dealers  Welcome to Austin Air austinair com dealers  Frome Physical Therapy  The Air Cleaner Store 11 Penn Plaza Suite B100 New York New York 10001 Directions  Website 	1
KN Dealer search www knfilters com dealersearch Factory direct KN replacement air filters air intakes oil filters  cabin filters KNFilterscom  the official site for performance filtration products	2
Air Purifiers  Target www target com c air purifiers home appliances   N 5xtus Shop Target for air purifiers you will love  Germ Guardian 22 TowerAC4825DLX 4in1 Air Purifier with HEPA Filter UVC Sanitizer and  Check nearby stores	1
Find A Retailer  US  Honeywell Home www honeywellhome com en find a retailer us Find a Retailer  USA Honeywell Home products are available at the following retailers The Home Depot Logo · Best Buy · ACE Hardware · Menards · Do It Best 	2
Rhode Island Room Air Cleaner Retailers www nationalgridus com media pdfs resi ways to save ri_roomaircleaner_retailers_2015 pdf Retailer Name Street City State Zip Phone Air Cleaners Home Depot 100 Stonehill Rd Johnston RI 02919 401 9429499 Y Home Depot 120 Franklin St	1
Where to Buy Blueair Air Purifiers  Blueair www2 blueair com no en store locator Locate where to buy a Blueair air purifier Shop online or in store choosing from our wide network of retail partners dedicated to cleaner healthier air	2
Air Purifiers HEPA Air Purifiers and Air Filters  Best Buy www bestbuy com site heating cooling air quality air purifiers abcat0908001 c id abcat0908001 Items 1  24 of 62  Shop Best Buy for your choice of air purifiers with HEPA filters smoke eaters air filters and air cleaners to help you breathe easy	1
Home Air Purifiers Air Cleaners  Honeywell Home www honeywellhome com en products air purifier Keep your family healthy with Honeywell air purifiers and air cleaners Units work in both home and work settings	2
Retail  Dynamic Air Quality Solutions  Commercial www dynamicaqs com commercial index php option com_content view article id 70 Itemid 187 Of the almost 5 million commercial buildings in the US retail buildings  With Dynamic Air Cleaners outside air requirements can be cut in half…or even to a 	2
Lennox Air Filters  Air Filter Replacement  Lennox Residential www lennox com owners parts and filters filters If you have any questions about the size you need you can refer to the owners manual for your furnace or air handler or contact your local Lennox Dealer	2
Where to Buy Coway Airmega and Coway Aquamega  Cowaymega www cowaymega com where to buy  You can buy Coway Airmega and Coway Aquamega products through our online shop with free shipping and qualified financing or through our partners	2
Air Cleaner Certification Information for Manufacturers  California  ww2 arb ca gov our work programs air cleaners ozone products air cleaner certification information manufacturers All air cleaning devices sold in the California including over the internet must  air cleaners in California are required to notify all of their distributors retailers 	2
Online Retailers – Rabbit Air www rabbitair com pages online retailers Sign up to receive exclusive offers and product updates Email Subscribe Products MinusA2 Air Purifier · BioGS 20 Air Purifier · Replacement Filters  	2
Where can I buy Molekule air purifiers – Molekule  Help Center help molekule com hc en us articles 115004040588 Where can I buy Molekule air purifiers  Molekule air purifiers are currently sold through our website and these select retailers B8ta Sprout and MoMA Design Store NYC Stay	2
Find A Dealer  aFe POWER afepower com find a dealer Find A Dealer  Find A Dealer Authorized Internet Retailers · Authorized Store Locations Get the Latest News Product Info and Deals Sign Up For Our 	2
Purchase Permatron Air Filters Online www permatron com residential purchase permatron air filters online Purchase Permatron air filters from online retail partners Permatron air filters can be purchased by homeowners and shipped directly to your home	2
FRAM Air Filters www fram com products consumer products air filters  Learn about each of our air filter product lines  EXTRA GUARD® TOUGH GUARD® and FRESH BREEZE®  to keep your engine running smooth and cabin 	2
Find a Local Oreck Vacuum Store  Repair Center Near Me  Oreck www oreck com stores  Cordless · Uprights · Handhelds and Canisters · Specialty Floor Cleaners · Product Bundles · Purifiers  Humidifiers · Accessories · Vacuum Bags · Special 	2
The Furnace and Air Conditioner Filters We Would Buy Reviews by  thewirecutter com reviews furnace and air conditioner filters we would buy  May 22 2019  If we were looking to buy a new filter today for our HVAC heating ventilation and air conditioning system wed aim for a mediumefficiency 	0
Wynd  Portable  Smart Air Purifiers  Home Air Quality Monitors shop hellowynd com  Our portable air purifiers  home air purifiers with Dual HEPA filters help in removing allergens dust dander smoke  pollution from the air Order today	2
Alen  Air Purifiers  Air Quality  The Home Depot www homedepot com b Heating Venting Cooling Air Quality Air Purifiers Alen N 5yc1vZc4m5Zefx Get free 2day shipping on qualified Alen Air Purifiers products or buy Heating Venting  Cooling department products today with Buy Online Pick Up in Store	1
Webproducts Home www webproducts com  WEB Products Inc manufactures a full line of furnace filters air conditioning filters air  If you prefer to purchase at a retailer please call our Customer Service 	2
Air Purifiers  Walmartcom www walmart com browse home improvement air purifiers 1072864_133032_1231459_46324 Shop for Air Purifiers in Air Quality Buy products such as Honeywell HPA300 True HEPA Air Purifier 465 sq ft Room Capacity Black at Walmart and save	1
Where to Buy  WIX Filters www wixfilters com wheretobuy aspx Where to buy WIX Products To find a WIX retailer near you please input a five digit US zip code or a six digit Canadian Postal Code into the box below Enter a 	2
Rainbow® Cleaning System rainbowsystem com  The Rainbow® Cleaning System provides certified air cleaning to your home  not make the mistake of purchasing your Rainbow from an unauthorized retailer	2
Air Purifiers  Accessories at Lowescom www lowes com pl Air purifiers accessories Heating cooling 4294856705 Shop air purifiers  accessories in the heating  cooling section of Lowescom Find quality air purifiers  accessories online or in store	1
IQAir is revolutionizing its dealer training classes www vdta com Magazines DEC07 fc iqairDec07 html IQAirs new Perfect 16 Retailer Program allows IQAir Authorized Dealers to sell IQAirs revolutionary new Perfect 16 wholehouse air cleaning system from their 	0
The 8 Best Air Purifiers For Your Home www forbes com sites forbes finds 2019 10 23 8 best air purifiers for your home  Oct 23 2019  This is also true when it comes to choosing an air purifier  Forbes searches premium retailers to find the new products — from clothes to 	0
Air Filters www acehardware com departments heating and cooling air quality air filters 431 items  Shop Standard 1in Furnance Filters at acehardwarecom and get Free Store Pickup at your neighborhood Ace Buy Online  Pickup Today	1
Auto Parts Professional Engine Air Filters  ACDelco www acdelco com auto parts filters professional engine air filters html Shop ACDelcocom for Professional Engine Air Filters and other auto part  Effective on parts purchased April 1 2018 and later to the original retail purchaser	1
Air Purifiers and the Cost of Clean Air  Consumer Reports www consumerreports org air purifiers air purifiers and the cost of clean air  Oct 25 2019  Air purifiers already cost a pretty penny but replacement filters and electricity  When you shop through retailer links on our site we may earn 	0
SB Filters  Performance Air Filters  Intakes www sbfilters com  SB Filters is a manufacturer of performance filters cold air intakes UTV Particle Separators  intake elbows Breathe easy Your engine and warranty are 	2
Air Filtration System  Home Air Purifier  Room Air Cleaner  www healthway com where to buy  By providing valuable information about indoor air quality and our filtration technology our dealers offer a great deal of added value To speak to a dealer near 	2
