Did You Know Cleaner Indoor Air Can Help Bring Your Retail Shop  cleanair camfil us 2016 02 22 did you know cleaner indoor air can help bring your retail shop more business  Feb 22 2016  Does your retail business need cleaner indoor air In the United States alone there are more than 3700000 retail establishments	0
Air Purifier Models m sharpusa com ForHome HomeEnvironment AirPurifier Models aspx Sharp HEPA Air Purifier with Plasmacluster® Ion Technology for Extra Large Rooms FPA80UW FPA80UW Suggested Retail 44999 Your Price 33499	2
Winix Air Purifiers  Bed Bath  Beyond www bedbathandbeyond com store s winix air purifiers Products 1  11 of 11  Shop for winix air purifiers at Bed Bath  Beyond Buy top selling products like Winix True HEPA 63002 Air Cleaner with PlasmaWave® 	1
SAMPLE NOTIFICATION LETTER FOR MANUFACTURERS DATE  www arb ca gov research indoor aircleaners sample_notification_letter pdf DATE TO Distributors Retailers and Sellers of Our Air Cleaners RE REGULATION FOR INDOOR AIR CLEANERS SOLD TO BUYERS IN THE STATE OF 	2
Alen Air Purifiers and Filters  Helping You Live Better With Pure Air www alencorp com  Alen air purifiers and air filters remove dust mold pet dander bacteria and smoke odors from your home Rated 1 in customer reviews Lifetime Warranty	2
IQAir Air Purifiers and Filters  Canadian IQAir Dealer  Free  www modernalchemyair com products iqair air purifiers  IQAir Air Purifiers Canada – Buy the worlds best air purifiers from Canadas leading IQAir dealer Serving Vancouver Toronto Calgary Montreal Ottawa Halifax 	1
Air Purifiers  Holmes Products www holmesproducts com air purifiers  Explore a variety of air purifiers from Holmes Products  find how you can improve the air quality for your home  family Shop Holmes Products today	2
Air Filters Delivered Store www airfiltersdelivered com  Air Filters Delivered Store  Air Filters for Your Home or Business with Free Shipping Every Day Shop by size image Shop By Size Select a size and 	1
Uni Filter unifilter com  Our engineers chose polyurethane foam as the air filtration media because of its superior dirt capturing abilities and its capacity to be easily cleaned and reused 	0
Allergy Clean Environments  www allergyclean com  Allergy Clean Environments is a sister company of the Allergy Air  More retail store Due to the changing retail environment we have decided to close the 	1
Air Purifiers  Dyson www dyson com air treatment purifiers html Dyson air purifiers automatically purify the air to remove 9997 of allergens pollutants and gases Heating and personal cooling with air purification	2
Air Purifiers — Levoit www levoit com airpurifiers A deep breath is typically a good thing But more often than not it hides lots of dust pollen pet dander mold spores or dust mite waste triggering all kinds of 	2
TexAir Filters – Air Filter Manufacturing Sales  Service www texairfilters com  TexAir Filters was started in 1976 to manufacture special size filters for residences and businesses in the DallasFort Worth Metroplex Since then the company 	2
American Standard®  Air Conditioning and Heating  HVAC Systems www americanstandardair com  Contact a local American Standard dealer near you today  American Standard AccuClean™ WholeHome Air Filtration systems can remove up to 9998 of 	2
Airaid Cool Air Intake Systems  Replacement Air Filters www airaid com  Reusable replacement air filters cold air intakes enclosed air box kits and performance products factory direct from Airaid	1
Extralarge room Air Purifier  Philips www usa philips com c m ho air purifier and air humidifier air purifier 5000 The Philips 5000i Series air purifier has double the purification not the size Our extralarge room air purifier  Buy from Retailers The Philips 5000i Series air 	2
Complaint Letter To IQAir Healthpro HEPA Air Purifiers www aircleaners com iq_air_letter  Some air purifiers remove dust and others will actually kill bacteria  This is your soon to be EX dealer By Choice Barry Cohen of Absolute Air Cleaners And 	0
Retailers – AHAM Verifide ahamverifide org retailers 2  Carrying Air Cleaners with the AHAM Seal is Good for Business  AHAM also provides retailers with CADR support materials including brochures and signage 	2
5 Best Air Purifiers 2019 HEPA PECO and More  WIRED www wired com gallery best air purifiers  Jul 28 2019  We tested many HEPA and standard air purifiers to find the right one for your  When you buy something using the retail links in our stories we 	0
Air Purifiers  Filters  Whirlpool www whirlpool com home solutions air purifiers and filters html Breathe easier with Whirlpool air filtration and purifying systems Well help you find the right filters for your appliance so you can enjoy fresh air	2
Air Filter  Best Air Filters for Cars  More www autozone com ignition tune up and routine maintenance air filter Keep your engine protected with a new engine air filter from AutoZone We have great deals on filters that are custom built for your vehicle from dependable 	2
Where To Buy  Purolator www pureoil com en contactus30 where to buy  Purolator filters can be found at traditional and online retailers nationwide If you have additional questions about where you can locate Purolator products call 	2
AAF International  AAF International www aafintl com  AAF offers the most comprehensive global manufacturing capabilities in the air filtration industry and each facility is specifically designed to manufacture and 	0
Online Store for Glasfloss ZLine Air Filters  Pleated Air Filters  filterstm com  Filter Systems is an Authorized Distributor for Glasfloss HVAC air filtration products and for Columbus Industries and Research Products paint booth filters	1
AllerAir  Manufacturer of Home  Office Air Purifiers www allerair com  The most efficient activated carbon filters and HEPA filters available Improve indoor air quality with industry leading air purifiers from AllerAir  Most air purifiers sold in retail stores do not have the filtration needed to adequately clean the air 	2
High Performance Cold Air Intakes and Performance Air Filters www r2cperformance com  R2C Performance air filters  cold air intakes are 1 in horsepower and unmatched in  R2C Drag Race Street Performance and Oval Track Products Retailer	1
Online retailers see spike in air purifier sales as haze continues  www channelnewsasia com news singapore online retailers see spike in air purifier sales as haze 11938844 Sep 25 2019  Online retailers say they have seen an increase in air purifiers sales of up to 10 times in recent weeks due to the haze But doctors are mixed in 	0
HardDrive Parts  Distributor of American VTwin Products www hdtwin com  Technology has wreaked havoc on the retail landscape but consumers still love to see touch and feel the products they are buying In order to compete 	1
Hyland Filter Service  Air Filter Service hylandfilterservice com  Hyland Filter Service Provides The Highest Quality Air Filters And Maintenance Service Across The US In Healthcare Retail Commercial And Industrial 	2
Molekule Air Purifier  MoMA Design Store store moma org for the home home home electronics molekule air purifier 516 126389 html Molekule uses nanotechnology to break down and eliminate pollutants on a molecular level	2
Home  SANUVOX sanuvox com  For over 21 years Sanuvox mission has been to improve indoor air quality in  Sanuvox Technologies Inc is a global leader in ultraviolet air purification  HVAC dealers have the opportunity to become Sanuvox Factory Authorized Dealers	2
Where to Buy Furnace Filters 29 Places To Choose From www goodairgeeks com where to buy furnace filters  At airfiltersdeliveredcom you can be sure to find the exact filter youre looking for They have all kinds of sizes models and 	2
HVAC Contractors  Air Conditioner Repair  Tempstar www tempstar com en us find a dealer  Tempstar® dealers will work with you to find the heating and cooling solution that best matches your home your budget and your comfort needs Search for a 	2
Air purifiers still struggling to get some air  The Economic Times m economictimes com industry services retail air purifiers still struggling to get some air articleshow 66629065 cms Nov 15 2018  Leading retailer Vijay Sales said it had sold 500 units of air purifiers last year in NCR and expects to double it this year “That is encouraging 	0
REME HALO® Whole Home InDuct Air Purifier  RGF www rgf com products air reme halo  The award winning REME HALO® whole home induct air purifier is the next generation of indoor air quality IAQ technology and capable of purifying every 	2
IQAir HealthPro Plus Air Purifier MedicalGrade Air   Amazoncom www amazon com IQAir HealthPro Plus Medical Grade HyperHEPA dp B002VXDCHW Buy IQAir HealthPro Plus Air Purifier MedicalGrade Air HyperHEPA Filter  Odors Smoke Pollen Dust Swiss Made HEPA Air Purifiers  Amazoncom ✓ FREE  or if you select a seller on the Amazon site that is not an authorized dealer 	1
KN  Advance Auto Parts shop advanceautoparts com brands k n Store Pickup CarQuest  2632 2232 Alum Rock Ave Unit 40 San Jose CA  95116 4082548218 Currently Out of Stock Check Nearby Stores Ship To Home	1
Sharper Image Closing All Stores www consumeraffairs com news04 2008 06 sharper_image html Jun 3 2008  Upscale retailer Sharper Image is closing all of its retail stores and  on Sharper Images signature product the Ionic Breeze air cleaner	0
Home Page for Carrier air conditioning heating refrigeration and  www carrier com residential en us  Carrier airconditioning and refrigeration solutions improves the world around us through  See your local Carrier dealer for complete details  From pumps to purifiers and condensers to controls we offer all the products you need to keep 	2
Factory Direct Filters Furnace Air Filters In Any Size www factorydirectfilters com  Factory direct HVAC Furnace Air Filters for home and business Shop standard custom and hard to find sizes FREE shipping	2
Where to Buy Friedrich Air Conditioners www friedrich com professional find distributor rep Find dealers distributors and service technicians who can sell install and service your Friedrich Air Conditioners	2
Winix Air Purifiers  Healthy Home Appliances  Improve Your Indoor  winixamerica com  Improve your air quality with Winix Air Purifiers Our air cleaners remove 9997 of particles with True HEPA Filtration and PlasmaWave Technology	2
Filtrete™ Smart Air Filters  Filtrete™ Smart App  FAQ www filtrete com 3M en_US filtrete about us smart faq  Frequently asked questions about Filtrete™ Smart Air Filters and the Filtrete™  Smart will show online retailer options to repurchase your current filter type and 	2
How to Purchase Water Filters and Air Filters  FAQ  SubZero Wolf  www subzero wolf com assistance answers how to purchase water filters and air filters Replacement water filters and air purification cartridges are available for  SubZero does not sell or recommend purchasing filters from online retailers such as 	0
VIDEO How to Install and Benefits of the Air Filter  KitchenAid  producthelp kitchenaid com Refrigeration Full size_Refrigerators Videos VIDEO%3A_How_to_Install_and_Benefits_of_the_Air_Filter Jul 30 2019  How to install the air filter on your KitchenAid refrigerator Air filters are available at some retailers including Amazon	0
Honeywell Store  Consumer Products  Fans  Thermostats  Filters  www honeywellstore com   and find all of the replacement filters and pieces to keep them up and running  Honeywell CF200A1016 4Inch Ultra Efficiency Air Cleaning Filter 20x25x45 	1
FPA80UW ExtraLarge Room Air Purifier  HEPA Purifier www sharpusa com forhome homeenvironment airpurifier models fpa80uw aspx The FPA80UW is the perfect air purifier for extralarge rooms This HEPA air purifier features Plasmacluster ion technology and so many  FIND RETAILER	2
What Happened to Ionic Breeze  Air Purifier Guide www airpurifierguide org faq what happened to ionic breeze We document the history of this air purifier brand why the parent company went  over 180 stores in the United States alongside an extensive online presence	0
Quantum Vacuum  Advanced Water Filtration Vacuum with Micro  quantumvac com  The Quantum Vacuum filters dirt  debris through its unique water filter so only clean purified air flows out Just empty the water for a fresh goodasnew filter 	2
Green Filter  High Performance Air Filters greenfilter com  Green Filter outperforms the competition discover why weve secretly been the favorite air filter to some of the worlds biggest racing brands and enthusiasts	2
Where to Buy Electrolux Appliances  Electrolux Store Locator www electroluxappliances com Where To Buy  Find out where to buy Electrolux home and kitchen appliances with our international store locator Bring home the best appliances with ease today	2
Filter  Parts  Donaldson Engine  Vehicle www donaldson com en us engine filters  We invented the first engine air filter 100 years ago Today were still  Were selective about who qualifies to represent Donaldson as distributor or dealer	2
Volant Performance Cold Air Intakes  Trucks SUVs and Cars volant com  Volant Performance sells the best Cold Air Intakes and Filters for Ford F150 Ford Raptor Chevrolet Silverado GMC Sierras Toyota Tundras Jeep SUV and 	2
Purolator Air Filters  Purolator Filters www purolatorairfilters com  Purolator Air Filters manufactures a full range of filters to help solve commercial industrial and residential air quality problems	2
Shop Simplicity Air Purifiers  Banks Vac banksvac com shop by brand simplicity simplicity air purifiers  Shop all Simplicity Air Purifiers  Banks Vacuum has all your needs	1
Trion Sales Locator www trioniaq com sales_locator MapSearchResults2 aspx code commercial HVAC Filters · Air Bear® Media Filters · MultiPleat · Polyester and Fiberglass · Dampers · Air Cleaners · Air Bear® Series · HE Plus Series · ComfortBreeze™ 	0
The Oreck Store  Vacuum  Air Purifier Sales  Service theoreckstore net  The Oreck Store is an authorized Oreck retail dealer that sells  services upright bagless  handheld vacuums steam mops air purifiers  more	1
SaniDry XP™ Basement Dehumidifier  Air Filtration System www basementsystems com basement dehumidifier sanidry xp dehumidifier html Creates dry clean air Reduces risk of mold growth Never needs to be emptied 10x  including the SaniDry XP are available only from an authorized dealer	2
Find Your Distributor www aprilairepartners com technical information find your distributor Find a Distributor in your area with our locator or call 18003346011 for assistance	2
Stores www webproducts com stores Stores We sell our products online Please browse our site to locate what you need If youd like to purchase from a retailer please call our Customer Service  Air Filters · Air Conditioner FiltersFurnace Filters · Odor Control FurnaceAC Filters 	1
Air CleanerCold Air Intake  OReilly Auto Parts www oreillyauto com shop b filters 16470 air cleaner cold air intake 12229 5e9decc98717 Results 1  24 of 3046  Order Air CleanerCold Air Intake for your vehicle and pick it up in store—make your purchase find a store near you and get directions	1
Distributor Wire  Cable Home www distributorwire com  Distributor Wire  Cable sells specialty wire  cable through distribution We pride ourselves in superior customer service and a focus on speed We serve 	1
Priority Wire  Cable www prioritywire com  Priority Wire  Cable is a modern manufacturer with the majority of our sales being  helped us become the fastest growing wire and cable supplier in the industry  The reels will have paralleled aluminum XHHW or THHN in any combination 	2
China scrap aluminum wirecopper wire scrap from Xingtai Retailer  aidu manufacturer globalsources com si 6008853763244 pdtl Aluminum scrap 1169111535 scrap aluminum wire copper wire scrap htm scrap aluminum wirecopper wire scrap scrap aluminum wires7207 • Min Order 25 Tons US • FOB Price US 1000  US 1500 • supplied by Xingtai Aidu 	2
Find a Retailer  Gyford Standoff Systems www standoffsystems com retailers  We are a wholesale only company and currently only sell to those individuals who have a resales or tax exempt license To find a retailer located in your area 	1
China scrap Aluminum wire from Xingtai Retailer Xingtai Aidu  aidu manufacturer globalsources com si 6008853763244 pdtl Aluminum ingot 1167715366 scrap Aluminum wire htm Aluminum Ingot scrap copper wire scrap Aluminum wire Pure Aluminum Ingot999 Chemical Composition al Weight 2025kg Al Min 99999	2
Top 10 Aluminium Wire Manufacturers in Kolkata  Best Aluminum  www justdial com Kolkata Aluminium Wire Manufacturers nct 10015454 Find ✓Wire Dealers ✓Wire Manufacturers ✓Copper Wire Manufacturers ✓Aluminium Wire Dealers ✓Aluminium Merchants in Kolkata Get Phone Numbers 	0
CPSC Publication 516  Repairing Aluminum Wiring www cpsc gov s3fs public 516 pdf aluminum wire connections that cause increased resistance to the flow of electric current resulting in  Homes built before 1965 are unlikely to have aluminum branch circuit wiring Electrical  consumers at common retailers No other crimp 	0
Shop for the Aluminum Hobby Wire at Michaels www michaels com aluminum hobby wire 10155479 html Ideal for hanging art projects or fixing fences the OOK® Aluminum Hobby Wire is a versatile tool for any tasks that need secure fastening	1
Wire and Cable  Graybar Store www graybar com store en gb wire and cable Shop our inventory of Wire and Cable online Graybar is your trusted distributor for Wire and Cable  Coaxial Cable Aluminum Shield PVC Jacket 18… AWG 	1
Aluminum Wires in Vadodara एल्युमिनियम की तार वडोदरा  dir indiamart com vadodara aluminum wires html Business listings of Aluminum Wires Aluminium Metalizing Wire manufacturers suppliers and exporters in Vadodara एल्युमिनियम की तार विक्रेता 	2
Feeney Inc www feeneyinc com  Feeney makes it easy with our stainless steel and aluminum architectural and garden products offering superior customer support  Find an Authorized Dealer	2
Monopricecom HDMI Cable Home Theater Accessories HDMI  www monoprice com  Monoprice Inc DBA MonoPricecom specializes in the wholesale distribution of world class cable assemblies for home theater PC and high technology 	1
Lawriter  ORC  473704 Scrap metal and merchandise container  codes ohio gov orc 4737 04 1 Scrap metal dealer means the owner or operator of a business that purchases or receives scrap metal for the purpose of  l Unclean aluminum wire	0
Aluminium Wire  online catalogue source  supplier of research  www goodfellow com E Aluminium Wire html Supplier of Metals Alloys Ceramics Polymers Compounds Intermetallics  Composites for  Aluminium Wire  Standard Products Click here to display prices 	2
Cerrowire Home www cerrowire com  We manufacture and distribute quality copper and aluminum wire and cable products including building wire portable cord and specialty wires Innovative 	2
Specialty Cable  Wire Master Distributor  OmniCable www omnicable com  OmniCable is a premier redistributor of wire and cable electrical productsand valueadded services OmniCable empowers our industry to be successful by 	1
Armature Wire and Aluminum Wire Armatures from Sculpture House www sculpturehouse com s 388 armatures wire aspx Wide variety of head figure and animal support sculpture armatures and multigauge aluminum wire to build your own armatures	0
Retail Merchandisers  K  S Precision Metals Full Line Metal  www ksmetals com retail html 12 pieces of Round Brass Aluminum and Copper tubing to go with Brass Rod  wire are now packaged with a small rubber sleeve to seperate for retail sales	1
Electrical Wire  Cable Distributors  Houston Wire  Cable Co www houwire com  Founded in 1975 Houston Wire and Cable HWC is a master distributor of industrial wire and cable supplying electrical distributors throughout the United 	2
Proposed tariff increase on steel and aluminum concerns some in  www bicycleretailer com industry news 2018 03 02 proposed tariffs steel and aluminum concerns some bike industry Mar 2 2018  US manufacturers that use steel and aluminum — both domestic and  It could mean ingot wire sheet and tubing products or steel used in  We source all the steel we use in our bike tubing from domestic suppliers so on 	0
Electric Fence Wire  Electric Fencing  The Home Depot www homedepot com b Lumber Composites Fencing Electric Fencing Electric Fence Wire N 5yc1vZc3q9 Get free 2day shipping on qualified Electric Fence Wire products or buy Lumber  Best Seller White Lightning 1320 ft 125Gauge  17Gauge Aluminum Wire	1
Wire Wrapping Wire  Jewelry Wire  Fire Mountain Gems and Beads www firemountaingems com shop wire_wrapping_wire Shop an extensive wire selection in true metal hues or colorful niobium aluminum and Zebra Wire® A variety of wire gauges and shapes provides jewelry 	0
Yazaki uses carbon nanotubes in alternative to copper wiring www autonews com technology how do you replace all copper wiring Aug 5 2019   the conductivity of aluminum as a replacement for copper wiring  Yazaki a leading supplier of vehicle wire harnesses proposes a new 	0
Aluminum Wire www thomasnet com products aluminum wire 94320405 1 html Manufacturer and distributor of standard and custom aluminum and aluminized cables and wire Collection system medium duty cables and thermocouple 	2
Wholesale Window Patio and Solar Screens An Authorized Phifer  www wholesalescreensandglass com  A Proud authorized distributor of Phifer Wire Products  The only aluminum screen developed specifically to protect against tiny insects this tightly woven	1
Electrical Wire  Cable at Sutherlands sutherlands com c Electrical Wire and Cable 109003007 Find value and selection on Electrical Wire  Cable and much more at Sutherlands  Sutherlands Home Improvement stores are your local source for hardware tools mulch building  404020 Aluminum URD Service Entry Cable	1
Cable Ladder Trays  Cablofil Cable Trays  Legrand www legrand us wire cable management cablofil ladder cable tray aspx Explore leading cable ladder and cable tray systems including ITray aluminum ladder trays and cable runways that provide innovative cable management 	1
Wire  Cable Your Way  Electrical Wire By the Foot www wireandcableyourway com  We offer a huge selection of wire and cable products cut to length Weve got the best prices anywhere with same day shipping Formerly Wire  Cable To Go	1
TWP Inc Wire Mesh for Home Industrial  Decorative Use www twpinc com  TWP Inc is an industry leading wire mesh product and laser cutting services provider We offer wire mesh screens wire cloth woven wire mesh and wire mesh 	2
Burndy  Electrical Connectors www hubbell com burndy en  Burndy manufactures connectors for splicing tapping terminating conducting or grounding and provides certification and testing of tool and connector 	2
Essex Magnet Wire  Global Leader for Innovative Magnet Wire  essexwire com  Global Leader in Magnet WireWinding Wire Manufacturing for Electric Vehicles Automotive  Industrial Applications for major OEM  Tier 1 suppliers  We offer a broad range of copper and aluminum magnet wire products to meet the 	2
Darby Wire Mesh www darbywiremesh com  Darby maintains an extensive inventory of wire mesh including aluminum brass  Edward J Darby  Son Inc – a leading supplier of woven and welded wire 	2
Buy Aluminum Wire online Aluminum Wire Wholesale  Pandahall  www pandahall com aluminum wire 396 1 html Pandahall Beads supplier provides high quality Aluminum Wire with cheap price You can buy Aluminum Wire in bulk or retail the Aluminum Wire has good cost 	2
Metals Depot®  Buy Metal Online Steel Aluminum Stainless Brass www metalsdepot com  Buy Metal Online at Metals Depot  Americas Metal Superstore Largest selection of Steel Aluminum Stainless and Brass at Wholesale Prices  Delivered 	1
Recycling Company www contracosta ca gov depart cd recycle options v6669 htm This vendor handles Bottles  Glass CRV Bottles  This vendor handles Aluminum Cans CRV Aluminum Cans NonCRV Aluminum Scrap BiMetal CRV Brass Copper Radiators Scrap Metal Nonferrous Wire Aluminum Wire Copper	0
Building Wire  Wire and Cable  Grainger Industrial Supply www grainger com category electrical wire cable building wire cable When it comes to Building Wire  Cable products Graingers got your back Easy online ordering and nextday delivery available with 247 expert product 	2
Central Steel and Wire Company Leading Metals Service Center  www centralsteel com  Central Steel and Wire is a leading metals distributor and fabricator with service centers in Chicago Milwaukee Lansing Cincinnati and Greensboro	1
Dent Fix Equipment Body Shop Equipment  United States www dentfix com  From Drilling through Boron Steel to fixing Aluminum Panels to Measuring Vehicle Dimensions to Punching  Distributor Stickers are available upon request	0
Westbury Aluminum Railing Systems from Wolf  Wolf Home Products www wolfhomeproducts com westburyrailing Westbury Aluminum Railing is made to be innovative strong and distinctive  VertiCable Offers contemporary vertical cables and balusters  Find A Dealer	2
Armature Wire – Jack Richeson  Co products richesonart com products armature wire Armature wire creates the structure that keeps a sculpture together and provides a framework upon which to work This economical aluminum wire is lightweight 	2
Magnet Wire Amazoncom www amazon com Metal Alloy Magnet Wire b ie UTF8 node 310354011 Results 1  16 of 123  Online shopping for Magnet Wire  Power Transmission Products from a  Copper and aluminum magnet wire are the most commonly used 	1
Aluminum Fence  Railing  Gates  Welcome to Ultra Aluminum™ www ultrafence com  20 More Aluminum Ultrarail™ – 20 more aluminum in all our rails with a full 8 ribs inside Maintains UltraStrength even when punched for pickets	2
