['Faucet Depot - Kitchen Faucets, Bathroom Faucets, Sinks ...', 'https://www.faucetdepot.com/', 'Faucet Depot is a leading retailer of kitchen faucets, bathroom faucets, sinks, showers, and plumbing supplies from Kohler, Moen, Insinkerator, Pfister, Grohe,\xa0...']
['Kitchen Faucets & Kitchen Sink Faucets at Ace Hardware', 'https://www.acehardware.com/departments/plumbing/faucet-and-faucet-repair/kitchen-faucets', '140 items ... Shop Kitchen Faucets at acehardware.com and get Free Store Pickup at your neighborhood Ace. Buy Online & Pickup Today. See Details.']
['Faucets, Kitchen Faucets, Bathroom Faucets, Sinks and Plumbing ...', 'https://www.faucet.com/', 'Shop online for thousands of faucets, sinks, bathroom, kitchen and shower fixtures. FREE SHIPPING on most items. Same day shipping on in stock items.']
['Moen | Bathroom & Kitchen Faucets, Shower Heads, Accessories ...', 'http://www.moen.com/', 'Shop a Wide Selection of Kitchen Faucets, Bathroom Faucets, Shower Fixtures, Accessories, Lighting and More at Moen.com. Buy it for looks, buy it for life.®']
['Luxury Bath and Kitchen - Complete Design Designation ...', 'https://www.waterworks.com/us_en', 'High-end faucets, fittings, bathtubs, washstands, stone, tiles, lighting, hardware & more. Shop online or find a showroom near you.']
['Water Saving Magellan Mini Widespread Lavatory Faucet, Retail ...', 'https://www.houzz.com/products/magellan-mini-widespread-lavatory-faucet-retail-pop-up-oil-rubbed-bronze-prvw-vr~63262193', 'With graceful curves and lines, the Kingston Brass Magellan Mini Widespread Lavatory Faucet features solid brass construction for outstanding performance\xa0...']
['Taps & mixers for bathrooms, showers and kitchens | hansgrohe INT', 'https://www.hansgrohe.com/', "What's right for you? Check out our range of products: Taps and mixers for wash basins, showers and bath tubs. Showers such as hand showers and overhead\xa0..."]
['Faucet Parts for Kitchen Faucets, Bathroom Faucets & Shower ...', 'https://www.ferguson.com/category/plumbing-parts-supplies/faucet-parts/_/N-zbq4h3', 'Shop faucet parts for all top brands, from bathroom faucet parts to kitchen faucet parts and more, online at Ferguson.com.']
['Wholesale And Retail Modern Classic Waterfall Bathroom Faucet ...', 'https://m.dhgate.com/product/wholesale-and-retail-modern-elegant-brushed/259631885.html', 'Wholesale cheap single handle single hole basin faucet brand -wholesale and retail modern classic waterfall bathroom faucet single handle mixer deck\xa0...']
["GROHE: Kitchen Faucets, Bath Faucets & Fixtures at Lowe's", 'https://www.lowes.com/b/grohe.html', 'Shop GROHE faucets and fixtures, from kitchen and bathroom faucets to shower heads and GROHE parts. Browse GROHE collections, like Ladylux and Atrio.']
['2019 Wholesale And Retail Free Shopping Copper Basin Faucet ...', 'https://m.dhgate.com/product/wholesale-and-retail-copper-basin-faucet/371121420.html', 'Wholesale cheap basin faucet brand -wholesale and retail free shopping copper basin faucet kitchen & bathroom faucet single hole of cold faucet retro style hat\xa0...']
['Kingston Brass Royale Widespread Bathroom Faucet with Retail ...', 'https://www.wayfair.com/home-improvement/pdx/kingston-brass-royale-widespread-bathroom-faucet-with-retail-pop-up-drain-kbbb1639.html', "You'll love the Royale Widespread Bathroom Faucet with Retail Pop-Up Drain at Wayfair - Great Deals on all Home Improvement products with Free Shipping\xa0..."]
['China Basin Faucet Seller | Chinese Bathroom Accessory Store from ...', 'https://www.dhgate.com/store/19937217', 'Luxbath online store sells basin faucet,bathroom accessory,kitchen faucet on DHgate.com, the reliable store with quality service in China.']
["Bathroom Faucets | Ken's Plumbing & Heating", 'https://www.kensplumbingandheating.com/plumbing-products/bathroom-faucets/', 'Coralais®. Single-handle centerset bathroom sink faucet with metal pop-up drain and lift rod. $155.00 Manufacturer Suggested Retail Price. Coralais Sink\xa0...']
['Modern Bathroom: Shop Bathroom Vanities, Sinks, Showers, Tubs ...', 'https://www.modernbathroom.com/', "... up to 70% online at Modern Bathroom, browse our collection of bathroom vanities, faucets, sinks, ... We are authorized retailers of the industry's best brands."]
['AF Supply | Kitchen, bath, hardware, HVAC and plumbing systems', 'https://www.afsupply.com/', 'AF Supply is a leading distributor of bath, kitchen, plumbing and heating supplies. ... Danze D455557 Opulence Single Handle Pull-Down Kitchen Faucet,\xa0...']
['SinkPositive Touch-Free Water/Space Saving Adjustable Toilet Tank ...', 'https://www.homedepot.com/p/SinkPositive-Touch-Free-Water-Space-Saving-Adjustable-Toilet-Tank-Retrofit-Sink-Faucet-Basin-White-HD214-01/205088518', 'Best Seller ... The SinkPositive touch-free sink/faucet basin replaces your toilet tank cover and uses fresh water from the supply line to enable hand washing,\xa0...']
['Kingston Brass Royale Mini Widespread Bathroom Faucet with ...', 'https://www.walmart.com/ip/Kingston-Brass-Royale-Mini-Widespread-Bathroom-Faucet-with-Retail-Pop-Up-Drain/32046135', 'Free Shipping. Buy Kingston Brass Royale Mini Widespread Bathroom Faucet with Retail Pop-Up Drain at Walmart.com.']
['GROHE - The Home Depot', 'https://www.homedepot.com/b/GROHE/N-5yc1vZ3zn', 'Centerset Single-Handle Bathroom Faucet in Starlight Chrome ... GROHE Veletto Single-Handle Pull-Down Dual Sprayer Kitchen Faucet with Soap Dispenser\xa0...']
['AAA Distributor: Philadelphia Wholesale Kitchen, Bathroom & Flooring', 'https://www.aaadistributor.com/', 'AAA Distributor help you with your entire kitchen, bathroom & flooring needs in Philadelphia, PA and surrounding areas. Call at 1.215.745.7900.']
['Kitchen Sinks | Costco', 'https://www.costco.com/kitchen-sinks.html', 'AFA Stainless Double Bowl 33" Dual Mount Kitchen Sink & Faucet Combo. Sign In For Price. $219.99. AFA Stainless Double Bowl 33" Dual Mount Kitchen Sink\xa0...']
['The Somerville Bath & Kitchen Store', 'https://www.thesomervillebathandkitchenstore.com/', 'The Somerville Bath & Kitchen Store Trained staff is ready to assist you with your selection of plumbing fixtures. Our trained professionals will assist you in the\xa0...']
['Kitchen Sinks | Costco', 'https://www.costco.com/kitchen-sinks.html', 'AFA Stainless Double Bowl 33" Dual Mount Kitchen Sink & Faucet Combo. Sign In For Price. $219.99. AFA Stainless Double Bowl 33" Dual Mount Kitchen Sink\xa0...']
['The Somerville Bath & Kitchen Store', 'https://www.thesomervillebathandkitchenstore.com/', 'The Somerville Bath & Kitchen Store Trained staff is ready to assist you with your selection of plumbing fixtures. Our trained professionals will assist you in the\xa0...']
['Strom Plumbing by Sign of the Crab | Wholesale Plumbing Products', 'https://signofthecrab.com/', 'Strom Plumbing wholesale plumbing products combine traditional style with modern technology. View our collection of solid brass faucets, tubs & accessories.']
['Faucet Warehouse - Warehouse prices on faucets, sinks ...', 'https://www.faucet-warehouse.com/', 'Kitchen. View Products. latest image .... (c) 2019 Faucet Warehouse, All Rights Reserved | Privacy Policy | Terms and Condition. Close. Checkout as a new\xa0...']
['T&S Brass: Top Selection of Faucets and Plumbing Parts - T&S Brass', 'https://www.tsbrass.com/', 'Narrow down your search by looking for products specific to your market segment. View All Markets · Restaurant · Education · Healthcare · Grocery/Retail.']
['Hudson Reed USA: Bathroom Showers, Designer Radiators, Luxury ...', 'https://usa.hudsonreed.com/', 'Bathrooms, showers, faucets and designer radiators for creating your luxurious bathroom and kitchen. Our huge range includes FREE SHIPPING with all our\xa0...']
['Build.com Smarter Home Improvement - Plumbing, Lighting, HVAC ...', 'https://www.build.com/', '... Customer Service 7 Days a Week, and FREE shipping offers on Faucets, Lighting, Door Hardware, Venting, Appliances, and much more. ... Bathroom Lighting.']
['Faucet Direct – Your Online Faucet Showroom', 'https://www.faucetdirect.com/', 'Faucet Direct is an online faucet showroom, specializing in faucets. Faucet experts available. ... Bathroom. Kitchen. Faucets. Showers. Sinks. Accessories. Lights.']
['Wolverine Brass | High Quality Plumbing Products Made for ...', 'https://www.plumbmaster.com/wolverinebrass/', '... products including kitchen faucets, bathroom faucets, shower fixtures, faucet parts ... Plumbmaster is now the exclusive distributor of Wolverine Brass products.']
['B & C Custom Hardware - Decorative Plumbing, Hardware, Kitchen ...', 'https://www.customhardware.net/', 'Come in to our showroom today to see our fine collection of faucets, kitchen sinks, bathroom sinks, bathtubs, toilets, bathroom accessories, hardware, cabinet\xa0...']
['Wholesale Sinks & Faucets - Toilets & Tubs - Quartz Surfaces ...', 'https://www.pelicansinks.com/', 'Wholesale supplier of sinks, faucets, toilets, tubs, quartz slabs, fabrication tools, porelain tile. Kitchen sinks, bathroom sinks, stainless steel, porcelain.']
['Bathroom Hardware', 'https://www.bedbathandbeyond.com/store/category/bath/bathroom-hardware/13456/', 'Products 1 - 24 of 968 ... Beautify your bath or powder room with bath hardware and bath fixtures from BedBathandBeyond.com - shop now to enjoy the best\xa0...']
['Decorative Plumbing Distributors - Fremont-CA', 'https://www.decorativeplumbing.com/', 'Decorative Plumbing Distributors Trained staff is ready to assist you with your selection of plumbing fixtures. Our trained professionals will assist you in the\xa0...']
['Two Handle 4" Centerset Lavatory Faucet With Retail...', 'https://www.bhg.com/shop/kingston-brass-two-handle-4-centerset-lavatory-faucet-with-retail-pop-up-brushed-nickel-p345b0f1ed247931e6059fe7381372b95.html', 'Shop hundreds of Bathroom Sink Faucets deals at once. We\'ve got two handle 4" centerset lavatory faucet with retail pop-up, brushed nickel and more!']
['Shop Bathroom Faucet - Great deals on Bathroom Faucet on ...', 'https://www.aliexpress.com/promotion/promotion_bathroom-faucet-promotion.html', '783295 products ... Shop our best value Bathroom Faucet on AliExpress. ... Free shipping Wholesale and Retail Promotion Chrome Brass Waterfall Bathroom\xa0...']
["Women's Perfume - Men's Cologne - Discount Perfume at ...", 'https://www.perfumania.com/', "Save up to 70% off top designer fragrance brands when you shop at Perfumania. We have a large selection of women's perfume, men's cologne, eau de toilette,\xa0..."]
["Launching and Growing Canada's Largest Online Fragrance Retailer -", 'https://www.starterstory.com/fragrancebuy', "May 6, 2018 ... Fragrancebuy is Canada's largest online fragrance retailer. We give fragrance enthusiasts access to a variety of discounted designer & niche\xa0..."]
['Wholesale Perfume Directory', 'https://www.wholesalecentral.com/Perfume.html', 'WORLDWIDE PERFUMES (PERFUME MARKET) Miami, Florida United States Wholesale distributor of Genuine Brand Name Perfumes. Top selling fragrances\xa0...']
['The Perfume Shop - Wikipedia', 'https://en.wikipedia.org/wiki/The_Perfume_Shop', "The Perfume Shop is a United Kingdom perfume retailer founded in 1992. The company was acquired by the world's largest health and beauty retailer, A.S.\xa0..."]
['Fragrance Outlet', 'https://www.fragranceoutlet.com/', "Fragrance Outlet is one of the nation's largest retailers with over 100 Stores of genuine designer fragrances including Calvin Klein, Dior, Gucci, and more."]
['Perfumania, Largest U.S. Fragrance Retailer Dumps Trump', 'https://www.dailykos.com/story/2015/7/9/1400709/-Perfumania-Largest-U-S-Fragrance-Retailer-Dumps-Trump', 'Perfumania, Largest U.S. Fragrance Retailer Dumps Trump. Jul 09, 2015 8:28am PDT by ericlewis0, Community. Comment large 46 57. Please log in or sign up\xa0...']
['Fragrance | Sephora', 'https://www.sephora.com/shop/fragrance', 'Shop fragrances for women and men at Sephora. Find your favorite perfume or cologne or accentuate your style with a new scent.']
['Perfume, Cologne & Discount Perfume', 'https://www.fragrancenet.com/', "Find discount perfume, discounts on leading brands of cheap women's perfumes, men's colognes, skin care and hair care products."]
['Ulta Beauty: Cosmetics, Fragrance, Skincare and Beauty Gifts', 'https://www.ulta.com/', 'ULTA Beauty offers customers prestige & mass cosmetics, makeup, fragrance, skincare, bath & body, haircare tools & salon. bareMinerals, Smashbox, Murad\xa0...']
['Thymes Store Locator | Sold in over 4,000 Locations', 'http://www.thymes.com/Store-Locator/', "Since Thymes offers such a wide array of fragrance collections, product selection may vary from store to store. If you're looking for a specific fragrance, we recommend you call the store you plan to visit to ... 4 Specialty Retailers In Your Area. 1."]
['Perfume, Cologne & Discount Perfume', 'https://www.fragrancenet.com/', "Find discount perfume, discounts on leading brands of cheap women's perfumes, men's colognes, skin care and hair care products."]
['Americas largest fragrance retailer Locations, Location, Address ...', 'https://www.creativejobscentral.com/americaslargestfragranceretailer', 'Directory of Americas largest fragrance retailer Locations, Careers, Address, HR | Creativejobscentral. Get locations, addresses, hr and human resources\xa0...']
['Scenting Retail Stores and Fashion Brands - Air Aroma', 'https://www.air-aroma.com/scenting/retail', 'In retail environments, candles can be dangerous and perfume sprays can be costly and inefficient. For an even and consistent level of scent throughout your\xa0...']
['Discount Perfume & Cologne | Buy Fragrances Online | Perfume.com', 'https://www.perfume.com/', "Check out America's leading online store for discount fragrances and discount perfumes ... Free shipping on thousands of fragrances. Save up to 80% off retail."]
['Scenting Retail Stores and Fashion Brands - Air Aroma', 'https://www.air-aroma.com/scenting/retail', 'In retail environments, candles can be dangerous and perfume sprays can be costly and inefficient. For an even and consistent level of scent throughout your\xa0...']
['Discount Perfume & Cologne | Buy Fragrances Online | Perfume.com', 'https://www.perfume.com/', "Check out America's leading online store for discount fragrances and discount perfumes ... Free shipping on thousands of fragrances. Save up to 80% off retail."]
["Perfume and Fragrance - Macy's", 'https://www.macys.com/shop/makeup-and-perfume/perfume?id=30087', "Shop Macy's large variety of perfumes from the most popular fragrance brands. Find the perfect scent for any occasion! FREE shipping on all beauty purchases."]
['fragrance - PSFK - Retail & CX Innovation Intelligence', 'https://www.psfk.com/tag/fragrance', 'Retail + CX innovation and trends insights on the topic of fragrance.']
['retail | sen7 - fragrance atomizer refillable for all fragrances', 'https://www.sen7.com/en-us/retail/', 'worldwide retail. sen7 is available from many specialist retailers around the world. Select your country and find a store near you! Please select a country. ×']
['Perfumania at South Shore Plaza® - A Shopping Center in Braintree ...', 'https://www.simon.com/mall/south-shore-plaza/stores/perfumania', "Perfumania, located at South Shore Plaza®: America's Largest Fragrance Retailer Perfumania specializes in the sale of genuine designer fragrances, bath and\xa0..."]
["London's Top 10 Perfume Shops", 'https://www.tripsavvy.com/top-ten-london-perfume-shops-1583068', "May 13, 2019 ... If you love fragrances, there's plenty to sniff at in London. From England's oldest perfume retailer to a store that supplies the royal family, we've\xa0..."]
['Stafford - The Fragrance Shop - Guildhall Shopping Centre', 'http://www.guildhallstafford.com/the-fragrance-shop', "Established in 1994, The Fragrance Shop is the UK's largest independent fragrance retailer. With over 175 stores nationwide showcasing over 130 sought-after\xa0..."]
['Aroma Retail 4 oz Fragrance Oil Refill - Asian Garden ... - Amazon.com', 'https://www.amazon.com/Aroma-Retail-Fragrance-Oil-Refill/dp/B07P1719C7', 'Buy Aroma Retail 4 oz Fragrance Oil Refill - Asian Garden, Experienced at Aria City Center Lobby, MGM Grand Hotel & Luxor Hotel Las Vegas: Home Fragrance\xa0...']
['AMERIKAS | Fragrance, Perfume, Health & Beauty Distributor USA', 'https://www.amerikas.com/', "Amerikas is one of USA's top distributors of fragrances, perfumes, cosmetics and health & beauty products."]
['The Perfume Shop', 'https://www.digitalgenius.com/casestudy/the-perfume-shop/', "Founded in 1992, The Perfume Shop is the UK's largest specialist fragrance retailer, with over 260 stores nationwide. They sell all major designer fragrance\xa0..."]
['Perfumania at Pleasant Prairie Premium Outlets® - A Shopping ...', 'https://www.premiumoutlets.com/outlet/pleasant-prairie/stores/perfumania', "Perfumania, located at Pleasant Prairie Premium Outlets®: America's Largest Fragrance Retailer Perfumania specializes in the sale of genuine designer\xa0..."]
['Retail | Perfumania Holdings', 'https://perfumaniaholdings.com/fragrance-brands/perfumania/retail/', "Perfumania Retail. America's largest fragrance retailer, Perfumania is a leading specialty retailer offering a wide range of brand name and designer fragrances."]
['Carner Barcelona perfume at Parfums Raffy - Carner Barcelona ...', 'https://www.parfumsraffy.com/brand/carner-barcelona', 'Buy from the complete collection of Carner Barcelona fragrances at Parfums Raffy - Authorized Carner Barcelona perfume retailer.']
['Store Locator - Fragrances of Ireland', 'https://www.fragrancesofireland.com/store-locator.html', 'Fragrances of Ireland & Inis the Energy of the Sea Store Locator Please note that stores may not stock all Fragrances of Ireland products. May we suggest a\xa0...']
['Dealers | Welcome to Austin Air', 'https://austinair.com/dealers/', 'Frome Physical Therapy / The Air Cleaner Store, 11 Penn Plaza, Suite B-100. New York, New York 10001, Directions | Website\xa0...']
['Air Purifiers : Target', 'https://www.target.com/c/air-purifiers-home-appliances/-/N-5xtus', 'Shop Target for air purifiers you will love. ... Germ Guardian 22" TowerAC4825DLX 4-in-1 Air Purifier with HEPA Filter, UVC Sanitizer and ... Check nearby stores.']
['Rhode Island Room Air Cleaner Retailers', 'https://www.nationalgridus.com/media/pdfs/resi-ways-to-save/ri_roomaircleaner_retailers_2015.pdf', 'Retailer Name. Street. City. State Zip. Phone. Air Cleaners. Home Depot. 100 Stonehill Rd. Johnston. RI. 02919 (401) 942-9499. Y. Home Depot. 120 Franklin St.']
['Air Purifiers: HEPA Air Purifiers and Air Filters - Best Buy', 'https://www.bestbuy.com/site/heating-cooling-air-quality/air-purifiers/abcat0908001.c?id=abcat0908001', 'Items 1 - 24 of 62 ... Shop Best Buy for your choice of air purifiers with HEPA filters, smoke eaters, air filters and air cleaners to help you breathe easy.']
['Alen - Air Purifiers - Air Quality - The Home Depot', 'https://www.homedepot.com/b/Heating-Venting-Cooling-Air-Quality-Air-Purifiers/Alen/N-5yc1vZc4m5Zefx', 'Get free 2-day shipping on qualified Alen, Air Purifiers products or buy Heating, Venting & Cooling department products today with Buy Online Pick Up in Store.']
['Air Purifiers - Walmart.com', 'https://www.walmart.com/browse/home-improvement/air-purifiers/1072864_133032_1231459_46324', 'Shop for Air Purifiers in Air Quality. Buy products such as Honeywell HPA300 True HEPA Air Purifier, 465 sq ft Room Capacity, Black at Walmart and save.']
['Air Purifiers & Accessories at Lowes.com', 'https://www.lowes.com/pl/Air-purifiers-accessories-Heating-cooling/4294856705', 'Shop air purifiers & accessories in the heating & cooling section of Lowes.com. Find quality air purifiers & accessories online or in store.']
['Air Filters', 'https://www.acehardware.com/departments/heating-and-cooling/air-quality/air-filters', '431 items ... Shop Standard 1in Furnance Filters at acehardware.com and get Free Store Pickup at your neighborhood Ace. Buy Online & Pickup Today.']
['Auto Parts: Professional Engine Air Filters | ACDelco', 'https://www.acdelco.com/auto-parts/filters/professional-engine-air-filters.html', 'Shop ACDelco.com for Professional Engine Air Filters and other auto part ... Effective on parts purchased April 1, 2018 and later to the original retail purchaser.']
['Winix Air Purifiers | Bed Bath & Beyond', 'https://www.bedbathandbeyond.com/store/s/winix-air-purifiers', 'Products 1 - 11 of 11 ... Shop for winix air purifiers at Bed Bath & Beyond. Buy top selling products like Winix True HEPA 6300-2 Air Cleaner with PlasmaWave®\xa0...']
['IQAir Air Purifiers and Filters | Canadian IQAir Dealer | Free ...', 'https://www.modernalchemyair.com/products/iqair-air-purifiers/', "IQAir Air Purifiers Canada – Buy the world's best air purifiers from Canada's leading IQAir dealer. Serving Vancouver, Toronto, Calgary, Montreal, Ottawa, Halifax\xa0..."]
['Air Filters Delivered Store', 'https://www.airfiltersdelivered.com/', 'Air Filters Delivered Store. ... Air Filters for Your Home or Business. with Free Shipping Every Day! Shop by size image. Shop By Size. Select a size and\xa0...']
['Allergy Clean Environments |', 'https://www.allergyclean.com/', 'Allergy Clean Environments is a sister company of the Allergy, Air & More retail store. Due to the changing retail environment we have decided to close the\xa0...']
['Airaid: Cool Air Intake Systems & Replacement Air Filters', 'https://www.airaid.com/', 'Reusable replacement air filters, cold air intakes, enclosed air box kits and performance products factory direct from Airaid.']
['Online Store for Glasfloss Z-Line Air Filters | Pleated Air Filters ...', 'https://filterstm.com/', 'Filter Systems is an Authorized Distributor for Glasfloss HVAC air filtration products and for Columbus Industries and Research Products paint booth filters.']
['High Performance Cold Air Intakes and Performance Air Filters', 'http://www.r2cperformance.com/', 'R2C Performance air filters & cold air intakes are #1 in horsepower and unmatched in ... R2C Drag Race, Street Performance and Oval Track Products Retailer.']
['HardDrive Parts - Distributor of American V-Twin Products', 'https://www.hdtwin.com/', 'Technology has wreaked havoc on the retail landscape but consumers still love to see, touch and feel the products they are buying. In order to compete,\xa0...']
['IQAir [HealthPro Plus Air Purifier] Medical-Grade Air ... - Amazon.com', 'https://www.amazon.com/IQAir-HealthPro-Plus-Medical-Grade-HyperHEPA/dp/B002VXDCHW', 'Buy IQAir [HealthPro Plus Air Purifier] Medical-Grade Air [HyperHEPA Filter] ... Odors, Smoke, Pollen, Dust; Swiss Made: HEPA Air Purifiers - Amazon.com ✓ FREE ... or if you select a seller on the Amazon site that is not an authorized dealer,\xa0...']
['K&N - Advance Auto Parts', 'https://shop.advanceautoparts.com/brands/k-n', 'Store Pickup. CarQuest - 2632. 2232 Alum Rock Ave Unit 40. San Jose, CA - 95116. 408-254-8218. Currently Out of Stock. Check Nearby Stores. Ship To Home.']
['Honeywell Store | Consumer Products | Fans | Thermostats | Filters ...', 'https://www.honeywellstore.com/', '... and find all of the replacement filters and pieces to keep them up and running. ... Honeywell CF200A1016 4-Inch Ultra Efficiency Air Cleaning Filter 20x25x4.5\xa0...']
["Shop Simplicity Air Purifiers | Bank's Vac", 'https://banksvac.com/shop-by-brand/simplicity/simplicity-air-purifiers/', "Shop all Simplicity Air Purifiers - Bank's Vacuum has all your needs."]
['The Oreck Store - Vacuum & Air Purifier Sales & Service', 'http://theoreckstore.net/', 'The Oreck Store is an authorized Oreck retail dealer that sells & services upright, bagless & hand-held vacuums, steam mops, air purifiers & more.']
['Stores', 'http://www.webproducts.com/stores', "Stores. We sell our products online. Please browse our site to locate what you need. If you'd like to purchase from a retailer please call our Customer Service ... Air Filters · Air Conditioner Filters/Furnace Filters · Odor Control Furnace/AC Filters\xa0..."]
["Air Cleaner/Cold Air Intake | O'Reilly Auto Parts", 'https://www.oreillyauto.com/shop/b/filters-16470/air-cleaner-cold-air-intake-12229/5e9decc98717', 'Results 1 - 24 of 3046 ... Order Air Cleaner/Cold Air Intake for your vehicle and pick it up in store—make your purchase, find a store near you, and get directions.']
['Distributor Wire & Cable: Home', 'https://www.distributorwire.com/', 'Distributor Wire & Cable sells specialty wire & cable through distribution. We pride ourselves in superior customer service and a focus on speed. We serve\xa0...']
['Find a Retailer | Gyford Standoff Systems', 'https://www.standoffsystems.com/retailers/', 'We are a wholesale only company and currently only sell to those individuals who have a resales or tax exempt license. To find a retailer located in your area,\xa0...']
['Shop for the Aluminum Hobby Wire at Michaels', 'https://www.michaels.com/aluminum-hobby-wire/10155479.html', 'Ideal for hanging art projects or fixing fences, the OOK® Aluminum Hobby Wire is a versatile tool for any tasks that need secure fastening.']
['Wire and Cable | Graybar Store', 'https://www.graybar.com/store/en/gb/wire-and-cable', 'Shop our inventory of Wire and Cable online. Graybar is your trusted distributor for Wire and Cable. ... Coaxial Cable, Aluminum Shield, PVC Jacket, 18… AWG\xa0...']
['Monoprice.com: HDMI Cable, Home Theater Accessories, HDMI ...', 'https://www.monoprice.com/', 'Monoprice, Inc. (DBA. MonoPrice.com) specializes in the wholesale distribution of world class cable assemblies for home theater, PC, and high technology\xa0...']
['Specialty Cable & Wire Master Distributor | OmniCable', 'https://www.omnicable.com/', 'OmniCable is a premier redistributor of wire and cable, electrical products,and value-added services. OmniCable empowers our industry to be successful by\xa0...']
