['Suess Electronics | Appleton, Wisconsin Technology Experts', 'https://suesselectronics.com/', "... Suess opened a small radio and television store on College Avenue in Appleton. ... Our antenna installation experts will help you get your free Green Bay-area local ... We don't carry every brand the big box stores do — and for good reason!"]
['Lafayette Electronic Supply', 'http://www.lafayetteelectronicsupply.com/', "CWY then spread its' reach into the cable TV supply business, gaining national ... Today Lafayette Electronic Supply is a full line electronic distributor and retailer. ... Between all the Type N connectors and the two Yagi antennas, Purdue IEEE\xa0..."]
['Satellite TV in Alpine, Texas | Big Canyon Television | DISH ...', 'https://www.bigcanyontv.com/', 'Big Canyon Television is an authorized DISH Satellite television Retailer specializing in Satellite television and Internet service in Alpine, Texas. ... Enjoy local sports, news, weather, and more in HD for FREE with an integrated digital antenna.']
['87 Pcs - One For All HDTV Amplified Indoor TV Antenna 50 mile ...', 'https://www.directliquidation.com/auction/301607_10247352-87-pcs-one-for-all-hdtv-amplified-indoor-tv-antenna-50-mile-range-8-feet-coaxial-cable-black-new-damaged-box-new-open-box-like-new-like-new-used-retail-ready/', '87 Pcs – One For All HDTV Amplified Indoor TV Antenna 50 mile range, 8 Feet ... New Damaged Box, New, Open Box Like New, Like New, Used – Retail Ready\xa0...']
['Satellite TV in Mesa, Arizona | DTR SATELLITE | DISH Authorized ...', 'https://www.dtrsatellite.com/', 'DTR SATELLITE is an authorized DISH Satellite television Retailer specializing in Satellite television and Internet service in Mesa, Arizona. ... The Tailgater® Portable Satellite TV Antenna lets you watch TV wherever you are – in the parking\xa0...']
['Satellite TV in San Diego, California | AmeriSat | DISH Authorized ...', 'https://www.amerisatsd.com/', 'AmeriSat is an authorized DISH Satellite television Retailer specializing in Satellite television and Internet service in San Diego, California. ... The Tailgater® Portable Satellite TV Antenna lets you watch TV wherever you are – in the parking lot\xa0...']
